제목,원제,개봉일,스트리밍,대여,평점,장르,재생 시간,감독,출연진,시놉시스,이미지,구매
혈의 누,,(2005),"[('Netflix', ['정액제', 'HD'])]","[('wavve', ['₩1,540', 'HD'])]","['74%', '6.6 (1k)']",['스릴러'],['1시간 59분'],['Kim Dae-seung'],"['Cha Seung-won', 'Park Yong-woo', 'Ji Sung', 'Yoon Se-ah', 'Cheon Ho-jin', 'Oh Hyeon-Kyeong', 'Choi Jong-won', 'Park Chul-min', 'Jeong Gyu-su', 'Park Choong-seon', 'Choi Ji-na', 'Yoo Hae-jin', 'Jang Suk-won', 'Hwang Choon-ha', 'Kim Wang-geun', 'Kwon Tae-won', 'Kim Ki-chun']","19세기, 조선시대 후반, 제지업을 기반으로 성장한 외딴 섬마을 동화도. 어느 날 조정에 바쳐야 할 제지가 수송선과 함께 불타는 사고가 벌어지고. 사건 해결을 위해 수사관 원규 일행이 동화도로 파견된다. 섬에 도착한 第 一 日, 화재사건의 해결을 서두르던 원규 일행 앞에 참혹한 살인 사건이 일어난다. 범인을 알 수 없는 살인 사건과 혈우가 내렸다는 소문에 마을 사람들은 7년 전, 온 가족이 참형을 당한 강 객주의 원혼이 일으킨 저주라 여기며 동요하기 시작한다. 그리고..... 사건 해결을 위해 냉철하게 추리해 나가던 원규 앞에 참혹한 또 다른 연쇄 살인 사건이 이어진다. 불길한 섬에 고립된 원규 일행은 살인범의 자취를 찾지 못한 채 광기어린 마을 사람들의 분위기에 궁지로 내몰리고.... 제지소 주인의 아들 인권은 흉흉한 마을 분위기를 강압적인 태도로 일관하며 원규와 끊임없이 대립하기만 한다. 여기에 참형 당한 강객주에게 은혜를 입었던 두호의 등장과 자신 역시 연쇄 살인 사건과 필연으로 이어져 있음을 알게 된 원규는 점점 더 깊은 혼란에 빠지게 되는데...",https://images.justwatch.com/poster/195646076/s276/blood-rain.webp,"[('wavve', ['₩6,050', 'HD'])]"
노스페이스,Nordwand,(2008),"[('wavve', ['정액제', 'HD']), ('Watcha', ['정액제', 'HD'])]","[('wavve', ['₩1,200', 'HD'])]","['80%', '7.4 (15k)']","['스릴러 , Made in Europe , 드라마 , 역사 , 스포츠']",['2시간 6분'],['Philipp Stölzl'],"['Benno Fürmann', 'Florian Lukas', 'Johanna Wokalek', 'Georg Friedrich', 'Simon Schwarz', 'Ulrich Tukur', 'Erwin Steinhauer', 'Branko Samarovski', 'Petra Morzé', 'Hanspeter Müller', 'Peter Zumstein', 'Martin Schick', 'Erni Mangold', 'Johannes Thanheiser', 'Arnd Schimkat', 'Klaus Ofczarek', 'Martin Brambach', 'Peter Faerber', 'Tobias Ofenbauer', 'Hartmut Scheyhing', 'Maximilian Pfnür', 'Gerhard Greiner', 'Hassan Athman', 'Nero Pietra', 'Stefan Steurer', 'Mark Geisseler', 'Matthias Roduner', 'Traute Hoess']","아이거 북벽은 알프스의 3대 북벽 중 하나로 현재까지도 가장 등반하기 어려운, 등반 역사상 사망자가 가장 많은 곳이다. 1936년 독일은 올림픽 개회를 앞두고 국위 선양을 위한 죽음의 아이거 북벽 초등을 위해 전세계 등반가들을 부추긴다. 군에서 산악병으로 복무 중이던 토니 (벤노 퓨어만)와 앤디(플로리안 루카스)도 처음엔 너무 위험한 일이라 망설이지만, 아이거 북벽 초등에 성공하고 싶다는 일념으로 등반을 결심한다. 이 사실이 알려지자 기..",https://images.justwatch.com/poster/174386516/s276/noseupeiseu.webp,"[('Naver Store', ['₩500', 'HD'])]"
Neo-wa na-eui i-shib-il-seki,Our Fantastic 21st Century,(2009),"[('Watcha', ['정액제', 'HD'])]",,"['64%', '6.1']",['드라마'],['1시간 23분'],['Ryoo Hyeong-gi'],"['Han Soo-yeon', 'Shin Hyun-ho', 'Lee Jae-hee-I']",수영은 이제 곧 지긋지긋한 마트 아르바이트를 그만둘 것이다. 지방흡입수술 비용을 거의 다 마련했기 때문이다. 그러나 동거남 상일이 그녀의 수술비를 가지고 잠적하게 되고 마트의 물건을 빼돌린 사실마저 발각되자 수영은 궁지에 몰린다. 결국 수영은 돈을 구하기 위해 마트에 상주하던 카드깡 업자 재범을 찾아간다. 남자 친구로부터 배신을 당한 그녀 앞에 사채업을 하는 새로운 남자가 등장한다. 그녀 역시 돈이 필요한 상태. 이 작품은 88만원 세대의 풍경인 동시에 자본주의 뒤에 도사리고 있는 좌절된 청춘의 모습을 그려내고 있다. 암울한 듯 하면서도 쿨하게 묘사하는 교차적인 태도가 21세기의 정신을 구현하고 있다.,https://images.justwatch.com/poster/153443286/s276/neo-wa-na-eui-i-shib-il-seki.webp,"[('Naver Store', ['₩1,000', 'HD'])]"
결혼 면허 따기,License to Wed,(2007),,"[('Naver Store', ['₩1,300', 'HD'])]","['61%', '5.3 (38k)']","['코미디 , 로맨스']",['1시간 31분'],['Ken Kwapis'],"['Robin Williams', 'Mandy Moore', 'John Krasinski', 'Eric Christian Olsen', 'Christine Taylor', 'Josh Flitter', 'DeRay Davis', 'Peter Strauss', 'Grace Zabriskie', 'Roxanne Hart', 'Mindy Kaling', 'David Quinlan', 'Angela Kinsey', 'Bob Balaban', 'Wanda Sykes', 'Brian Baumgartner', 'Dylan Gentile']","최근 약혼한 커플, 벤 머피와 새디 존스는 하루라도 빨리 결혼해 행복한 가정을 이루는 것이 꿈이다. 하지만 이를 위해서는 한가지 넘어야할 장애물이 남아있으니, 새디의 가족교회인 성 아우구스틴 교회의 리버렌드 프랭크 목사가 내는 숙제를 통과해야 하는 것. 프랭크 목사는 자신이 특허를 낸 결혼 예행 코스를 통과하지 않으면 둘의 결혼을 축복해 줄수 없다고 선언한 것이다. 터무니없는 수업과 이상한 숙제들로 이루어진 이 테스트를 벤과 새디 커플은 어떻게 통과할 것인가?",https://images.justwatch.com/poster/241193288/s276/license-to-wed.webp,"[('Naver Store', ['₩4,950', 'HD'])]"
밀양,,(2007),"[('Netflix', ['정액제', 'HD']), ('Watcha', ['정액제', 'HD'])]","[('wavve', ['₩1,540', 'HD']), ('Naver Store', ['₩1,540', 'HD'])]","['79%', '7.5 (7k)']",['드라마'],['2시간 22분'],['Lee Chang-dong'],"['Jeon Do-yeon', 'Song Kang-ho', 'Jo Young-jin', 'Seon Jeong-yeop', 'Kim Young-jae', 'Park Myung-shin', 'Kim Mi-kyoung', 'Oh Man-seok', 'Jang Hye-jin', 'Lee Sung-min', 'Mi-hyang Kim', 'Lee Hee-jun', 'Kim Jong-soo', 'Yeom Hye-ran', 'Lee Yun-hui', 'Go Seo-hee', 'Lee Dong-yong', 'Kim Min-jae']","신애는 교통사고로 죽어버린 남편의 고향 밀양으로 아들 준을 데리고 이사한다. 오는 길에 고장난 차를 고쳐주러 온 카센터 사장 종찬의 렉카를 타고 밀양으로 들어가는 세 사람. 신애는 남편의 고향에 덩그러니 정착한 모자를 측은하게 보는 사람들에게 애써 씩씩하게 군다. 종찬은 이 속모를 여자를 그날부터 졸졸 따른다. 살 집을 구해주고, 피아노 학원을 봐주고, 그녀를 따라 땅을 보러 다니며 그의 하루 일과는 시작된다. 늘 네댓 걸음 뒤에서, 부르면 다가서고 밀쳐내면 물러나면서.",https://images.justwatch.com/poster/10978836/s276/secret-sunshine.webp,"[('wavve', ['₩6,050', 'HD']), ('Naver Store', ['₩6,050', 'HD'])]"
학생회장 암살하기,Assassination of a High School President,(2008),,"[('wavve', ['₩2,500', 'HD'])]","['66%', '6.2 (15k)']","['범죄 , 코미디']",['1시간 33분'],['Brett Simon'],"['Mischa Barton', 'Reece Thompson', 'Bruce Willis', 'Michael Rapaport', 'Kathryn Morris', 'Melonie Diaz', 'Emily Brownell', 'Gabrielle Brennan', 'Zach Roerig', 'Tanya Fischer', 'Michael Zegen', 'Kimberly Magness', 'Aaron Himelstein', 'Joe Perrino', 'John Magaro', 'Robin Lord Taylor', 'Zoë Kravitz', 'Vincent Piazza', 'Zachary Booth', 'Emily Meade', 'Adam Pally', 'Luke Grimes', 'Laura Ford', 'Quinn Shephard', 'Josh Pais']","고등학교를 배경으로, 학생회의 비리를 파헤치는 교내 학생 기자의 이야기를 다룬 코믹 범죄 스릴러물.",https://images.justwatch.com/poster/184494852/s276/hagsaenghoejang-amsalhagi.webp,"[('Naver Store', ['₩2,000', 'HD'])]"
부그와 엘리엇 2,Open Season 2,(2008),,"[('Naver Store', ['₩1,300', 'HD'])]",['65%'],['코미디'],['1시간 16분'],"[""Matthew O'Callaghan""]","['Mike Epps', 'Joel McHale', 'Jane Krakowski', 'Billy Connolly', 'Crispin Glover', 'Steve Schirripa', 'Georgia Engel', 'Diedrich Bader', 'Cody Cameron', 'Fred Stoller', 'Olivia Hack', 'Danny Mann', 'Maddie Taylor', 'Nika Futterman', 'Sean Mullen', 'Michelle Murdocca', 'Jacquie Barnbrook', 'Kevin Michael Richardson', 'Maurice LaMarche', 'Maurice LaMarche', 'Jeff Bennett', 'John Hans Tester', 'Walter Jones']","전세계를 뒤집어 놓은 유쾌한 두 녀석 ‘부그’와 ‘엘리엇’이 돌아왔다! 이번엔 소심한 야생동물과 터프한 애완동물의 신나는 1박 2일이다! 인간 세계에서 길들여진 어린 시절을 잊고 이제는 친구들과 토끼 대포알 놀이를 즐기고, 먹고 싶은 대로 먹으며 야생에서의 생활을 만끽하는 ‘부그’와 ‘엘리엇’! ‘엘리엇’과 그의 여자친구 ‘지젤’의 행복한 결혼식 날, 스스로 애완동물임을 거부해 야생계로 도망쳐 온 철부지 애완견 ‘위니’가 먹을 것의 유혹을 못 이기고 다시 인간 세계로 돌아간다. ‘위니’를 구출하기 위해 ‘부그’와 ‘엘리엇’ 일행은 애완동물들과 인간들의 행복한 소풍 때 맞춰 탈출 작전을 시도하지만, 우아한 외모, 까칠한 성격의 애완동물의 리더 ‘피피’의 저항에 1박 2일간의 대결은 오히려 애완동물의 승리로 기울기 시작하는데… 야생과 애완동물 사이에 낀(?) 우유부단 ‘위니’를 구하기 위한 ‘부그’와 ‘엘리엇’의 구출작전은 과연 성공할 수 있을까?",https://images.justwatch.com/poster/185219578/s276/bugeuwa-elrieos-2.webp,"[('Naver Store', ['₩5,000', 'HD'])]"
"두뇌유희프로젝트, 퍼즐",,(2006),,"[('wavve', ['₩1,540', 'HD'])]","['65%', '6.3']","['스릴러 , 범죄']",['1시간 31분'],['Kim Tae-kyung'],"['Joo Jin-mo', 'Moon Sung-keun', 'Hong Seok-cheon', 'Hyun Sung', 'Park Jun-seok', 'Kim Dae-myung']","전혀 알지 못하던 다섯 사람이 저마다 특별한 사연을 가지고 정체불명의 누군가에 의해 모이게 된다. 목적도, 이유도 모른체 함께 하게 된 그들은 프로젝트의 성공 후 꿈 같은 보상을 기대하며 프로젝트의 주체를 X로 명명하고, X의 계획에 합류한다. 드디어, D-day! 치밀하게 준비해 은행에 도착한 류, 노, 정, 규. 환의 작전대로 모든 과정들이 일사천리로 진행되지만 예상치 못한 작은 실수가 계획에 오류를 만들고, 경찰에게 포위된 그들은 인질을 잡아 겨우 탈출에 성공한다. 그리고, 환과의 약속장소에 가지만 이미 환은 살해당한 후... 이들은 뭔가 잘못되어가고 있음을 깨닫게 되고 서로를 의심하기 시작하는데… 과연 X는 누굴까… X는 대체 어떤 목적을 가지고 왜 이들을 부른 것일까… 이 치밀하고 거대한 퍼즐을 누가, 왜 계획한 것일까…",https://images.justwatch.com/poster/11176988/s276/puzzle.webp,"[('wavve', ['₩6,050', 'HD'])]"
백만장자의 첫사랑,,(2006),"[('Netflix', ['정액제', '정액제']), ('wavve', ['HD'])]","[('wavve', ['₩1,200', 'HD'])]","['79%', '7.2 (5k)']","['드라마 , 로맨스 , 코미디']",['1시간 56분'],['Kim Tae-gyun'],"['Lee Yeon-hee', 'Hyun Bin', 'Lim Ju-hwan', 'Jeong Wook', 'Lee Young-hoo', 'Lee Kan-hie', 'Do Yong-gu']","모처럼 학교에 갔다. 왜? 학교와 굿바이 하러! 학교 다니는 것도 지겹고, 경찰서 다니는 것도 귀찮다. 할아버지 유산 받는 날, 가볍게 박차고 나올 생각이었으니 하루 덜 채운들 무슨 상관! 진정한 백만장자가 되는 주민등록증을 받아들 내일이 기다려진다. 내일은 내 생애 최고의 날이다. 음화화홧! 오늘이면 수 천억이 내 껄 줄 알았다. 이런.... 그 밉살맞은 변호사가 언젠가는 내 발등에 도끼를 찍을 줄 알았다. 젠장. 그 산골엔 왜 가라는 거야? 그 학교는 왜 꼭 졸업해야 하는데? 할아버지! 왜 절 이렇게 골탕 먹이시는 겁니까!!! 도대체 왜!!!!! 이 놈의 구질구질한 산골. 그리고 이 자식들은 순진한 건지, 단순한 건지 도대체 정체들을 알 수가 없다. 교장에게 돈을 주고 퇴학만 시켜달래도 도무지 말이 씨도 안 먹힌다. 전학 첫 날부터 반장이라 잘난 체 하는 은환이란 계집애는 사사건건 태클을 건다. 그런데 이상하다. 언제부턴가 어이없게도 그 뻣뻣하고 멋대가리 없는 계집애만 보면 가슴이 두근거린다. 내가 왜 이러는 거지? 지금 당장 이 산골학교를 벗어나야 하는데... 유산에만 신경 써야 하는데...",https://images.justwatch.com/poster/179482086/s276/baegmanjangjayi-ceossarang.webp,
지구,Earth,(2007),,"[('wavve', ['₩1,000', 'HD'])]","['84%', '8.0 (14k)']","['다큐멘터리 , Made in Europe']",['1시간 30분'],"['Alastair Fothergill , Mark Linfield']","['Patrick Stewart', 'Constantino Romero', 'James Earl Jones', 'Ken Watanabe', 'Ulrich Tukur', 'Anggun']",생명의 땅을 찾아 나선 동물 가족들의 지구 대장정 어드벤처,https://images.justwatch.com/poster/176361820/s276/jigu.webp,"[('Naver Store', ['₩1,000', 'HD'])]"
12 라운드,12 Rounds,(2009),"[('Disney Plus', ['정액제', 'HD'])]",,"['66%', '5.6 (28k)']","['스릴러 , 액션 , 범죄']",['1시간 48분'],['Renny Harlin'],"['John Cena', 'Aidan Gillen', 'Ashley Scott', 'Brian J. White', 'Taylor Cole', 'Gonzalo Menendez', 'Steve Harris', 'Nick Gomez', 'Billy Slaughter', 'Kyle Clements', 'Peter Navy Tuiasosopo', 'Travis Davis', 'Brian Stanton', 'Rosalind Rubin', 'Kim Collins', 'Lara Grice', 'Douglas M. Griffin', 'Vincent Flood', 'Robert Pralgo', 'Wally Crowder', 'Luke Albright', 'John Wilmot', 'Louis Herthum', 'David Frye', 'Roy Huang', 'Bill Martin Williams', 'J. Omar Castro', 'Brandi Coleman', 'Mikki Val', 'Jada K. Cox', 'Hunter Burke', 'Danie Coleman']",더 이상 타협은 없다,https://images.justwatch.com/poster/184866517/s276/12-rounds.webp,"[('wavve', ['₩5,500', 'HD']), ('Naver Store', ['₩5,500', 'HD'])]"
빅 마마 하우스: 근무중 이상무,Big Momma's House 2,(2006),"[('Amazon Prime Video', ['정액제', 'HD'])]",,"['60%', '4.8 (42k)']","['범죄 , 코미디']",['1시간 39분'],['John Whitesell'],"['Martin Lawrence', 'Marisol Nichols', 'Kevin Durand', 'Dan Lauria', 'Kat Dennings', 'Josh Flitter', 'Zachary Levi', 'Jascha Washington', 'Jeanene Fox', 'Mark Moses', 'Chloë Grace Moretz', 'Emily Procter', 'Nia Long', 'Lisa Arrindell', 'Bryan James Kitto', 'Luke Ramsey', 'Lonnie Lamont', 'Marcus Lyle Brown', 'Mehera Blum', 'Shanna Moakler']","FBI 요원 말콤 터너(마틴 로렌스 분)는 국가안보에 치명적인 컴퓨터 “웜”을 디자인하는 용의자를 잡으러 떠난다. 불행히도, 말콤이 웜의 설계자인 톰 풀러 (마크 모세스 분)에게 접근할 수 있는 방법은 풀러와 그의 아내 라이 (에밀리 프록터 분)의 아이들: 어린 앤드류와 그의 두 누나들, 캐리와 몰리의 새로운 “가정부”로 들어가는 것이다. 이 말은 말콤이 다시 한 번 ‘빅 마마’로 변장을 해야 한다는 것. 그러나 그의 프로페셔녈한 ‘빅 마마’로서의 작전수행은 번잡스러운 3명의 풀러 아이들과, 기가 죽어서우울증에 빠져버린 강아지, 수많은 일과 돌보기 때문에 번번히 위기에 빠진다. 동시에 그는 비밀리 톰의 컴퓨터 바이러스에 대해서도 알아내야 한다. 물론 말콤에게 가장 어렵고 웃긴 과제는 “빅 마마”로 들키지 않고 있어야 한다는 것이다. 과연, 말콤 터너는 ‘빅 마마’를 들키지 않고 무사히 임무수행과 이 특이한 폴러 가족들 틈에서 살아남을 수 있을까?",https://images.justwatch.com/poster/175562548/s276/big-mommas-house-2.webp,"[('wavve', ['₩5,500', 'HD']), ('Naver Store', ['₩5,500', 'HD'])]"
웰컴 투 동막골,,(2005),"[('Netflix', ['정액제', 'HD']), ('wavve', ['정액제', 'HD']), ('Watcha', ['정액제', 'HD'])]","[('wavve', ['₩1,200', 'HD']), ('Naver Store', ['₩1,200', 'HD'])]","['81%', '7.6 (6k)']","['드라마 , 코미디 , 전쟁']",['2시간 13분'],['Bae Jong'],"['Jung Jae-young', 'Shin Ha-kyun', 'Kang Hye-jung', 'Steve Taschler', 'Im Ha-ryong', 'Seo Jae-kyeong', 'Ryu Deok-hwan', 'Jung Jae-jin', 'Jo Deok-hyeon', 'Hong Ye-In', 'Lee Yong-nyeo', 'Nam-Hee Park', 'Kwon Oh-Min', 'Yoo Seung-mok', 'Shim Won-cheol', 'Yu Chang-Guk']","1950년 11월, 한국 전쟁이 한창이던 그 때, 태백산맥 줄기를 타고 함백산 절벽들 속에 자리 잡은 마을, 동막골. 이 곳에 추락한 P-47D 미 전투기 한 대. 추락한 전투기 안에는 연합군 병사 스미스가 있었다. 동막골에 살고있는 여일은 이 광경을 목격하고 소식을 전달하러 가던 중 인민군 리수화 일행을 만나게 되고 그들을 동막골로 데리고 온다. 바로 그 때, 자군 병력에서 이탈해 길을 잃은 국군 표현철과 문상상 일행이 동막골 촌장의 집까지 찾아 오게 되면서 국군, 인민군, 연합군이 동막골에 모이게 되고 긴장감은 극도로 고조되는데...",https://images.justwatch.com/poster/243757130/s276/welcome-to-dongmakgol.webp,"[('Naver Store', ['₩5,500', 'HD'])]"
낙원 - 파라다이스,낙원-파라다이스,(2009),"[('Watcha', ['정액제', 'HD'])]",,['84%'],['드라마'],['1시간 49분'],['Lee Jang-Soo'],"['Kim Ha-neul', 'Ji Jin-hee', 'Kim You-jung', 'Jeon Soo-kyung', 'Jung Min-sung', 'Chu Kwi-jung']","“그냥 이번에 오는 열차의 종착역까지 주세요.” 이제 막 교도소에서 나와 세상의 모든 것이 낯설기만 한 여자 `미경`. 반겨줄 가족도 돌아갈 집도 없는 그녀는 무작정 따뜻한 남쪽으로 가는 기차에 올라타고, 우연히 아름다운 섬 하나도의 광고 전단지를 보게 된다. 햇살이 가득한 초원과 울창한 나무가 있는 사진 위로 `지상 최후의 낙원`이라는 문구에 시선을 빼앗긴 그녀. 망설임 없이 하나도로 향하지만 눈 앞에 펼쳐진 것은 `낙원`과는 거리가 먼 쓸쓸한 풍경뿐이다. “여기에서, 나랑 같이 행복해져요.” 실망을 접고 `이유리`라는 이름으로 하나도의 초등학교 급식소에서 일을 시작한 미경. 그곳에서 호의적이고 순수한 초등학교 교사 `일호`와 낯선 남자를 집으로 들이는 엄마를 원망하며 숲속에만 틀어 박힌 아이 `화란`, 그리고 늘 같은 음악을 들으며 슬픈 추억에 잠기는 괴팍한 성격의 여자 `아람`을 만난다. 교도소에 가야 했던 자신의 과거와 놀랍도록 닮은 화란과는 친구가 되고, 그녀의 비밀을 알면서도 따뜻하게 다가오는 일호에게 조금씩 마음을 열어가는 미경. 과연 그녀는 과거의 상처를 잊고 진정한 파라다이스를 찾을 수 있을까?",https://images.justwatch.com/poster/23261945/s276/paradaiseu-2009.webp,"[('Naver Store', ['₩500', 'HD'])]"
축구의 신: 마라도나,Maradona by Kusturica,(2008),"[('Watcha', ['정액제', 'HD'])]","[('wavve', ['₩1,000', 'HD'])]","['73%', '6.8 (6k)']","['다큐멘터리 , 스포츠 , Made in Europe']",['1시간 30분'],['Emir Kusturica'],"['Diego Maradona', 'Manu Chao', 'Emir Kusturica']","1986년 멕시코 월드컵에서 전 세계를 발칵 뒤집어놓은 사건이 발생한다. 아르헨티나라는 작은 나라의 선수 디에고 마라도나가 잉글랜드와의 경기에서 핸들링 파울을 범하여 득점을 한 것. 하지만 이 명백한 파울은 골로 인정되고, 그는 '신의 손'이라는 오명을 지니게 된다. 그러나 3분 뒤, 홀로 6명을 제치며 60미터를 달려간 그가 추가골을 터뜨린다. 신의 손이라는 오명을 지녔지만 현존하는 최고의 선수라는 명예도 함께 가진, 축구의 신 마라도나가 탄생하는 순간이다. 칸 영화제 3회 수상에 빛나는 거장 감독 에밀 쿠스트리차는 인간 마라도나를 카메라에 담기로 한다. 아직까지 그에 대해 제대로 담은 작품이 단 한 편도 없다는 안타까움으로 시작한 작품은, 당당한 척 살고 있지만 수 많은 사건사고로 더 유명한, 그러나 현재까지도 살아있는 영원한 영웅이라는 칭호를 받고 있는 인간 마라도나를 제대로 그리기로 한다. 자신과 가장 가깝게 닮은 인물이라 생각한 바로 그 사람을. 하지만 첫 만남부터 서로의 삶과 사상을 관통하는 공통점들을 하나씩 발견하게 되는데…",https://images.justwatch.com/poster/138660625/s276/maradona-by-kusturica.webp,"[('Naver Store', ['₩1,000'])]"
럭키 유,Lucky You,(2007),,"[('Naver Store', ['₩1,300', 'HD'])]","['64%', '5.9 (20k)']","['드라마 , 스포츠 , 로맨스']",['2시간 4분'],['Curtis Hanson'],"['Eric Bana', 'Drew Barrymore', 'Robert Duvall', 'Debra Messing', 'Robert Downey Jr.', 'Phyllis Somerville', 'Horatio Sanz', 'Michael Shannon', 'Robin Wilson', 'Joey Kern', 'Delaine Yates', 'Elisabeth Granli', 'Jean Smart', 'Mykel Shannon Jenkins', 'Charles Martin Smith', 'Saverio Guerra', 'Danny Hoch', 'Kenny Cau', 'Kelvin Han Yee', 'Jack Younger', 'Tracy Howe', 'Sonny Surowiec', 'Madeleine Peyroux', 'Hans Howes', 'Bradford English', 'Omar Benson Miller', 'Spencer Conner', 'Yetta Gottesman', 'Sam Farha', 'Chau Giang', 'Barry Greenstein', 'Jason Lester', 'Ted Forrest', 'Minh Ly', 'John Murphy', 'Erick Lindgren', 'Daniel Negreanu', 'Dara Khy', 'Pat M. Maresca', 'Joe Witherell', 'Sheila Hanson', 'Lisa Glossop', 'Danny Sanchez', ""Sam O'Connor"", 'Pat Callihan', 'Tina Schafer', 'Crystal Simanek', 'Robby Bostick', 'Olivia Tracey', 'Gay Burch', 'Jimmy Williams', 'Bill McKinney', 'Jennifer Harman', 'Mark Tymchyshyn', 'Norris Watsky', 'Shawn Parr', 'Matt Savage', 'Francine Beers', 'Laasa Howard', 'Richard Assad', 'Evan Jones', 'John Hennigan', 'David Oppenheim', 'Bill May', 'Ling Jo Eusebio', 'Jack Binion', 'Doyle Brunson', 'Johnny Chan', 'Hoyt Corkins', 'Antonio Esfandiari', ""Chris 'Jesus' Ferguson"", 'Dan Harrington', 'Phil Hellmuth', 'Karina Jett', 'John Juanda', 'Mike Matusow', 'Erik Seidel', 'Mimi Tran', 'Marsha Waggoner', 'Robert Williamson III', 'Cyndy Violette', 'Eddie Hill', 'Charlene Sperske', 'Kyle Morris', 'Deena Trudy', 'Bonnie Joy Ashley', 'Tad Atkinson', 'Michelle Borth', 'Ken Davitian', 'Lorilynn Failor', 'Gina Fricchione', 'Maya Hazen', 'Lindsay MacFarland', 'Lani Sarem', 'Delia Sheppard', 'Laura Ann Tull']","대표적인 도박의 도시 라스베가스. 포커계의 샛별 같은 존재인 헉 치버는 뛰어난 재능으로 연승을 거둔다. 2003년 세계 포커 대회의 우승을 노리는 헉의 최대 라이벌은 다름 아닌 포커계의 살아있는 전설인 L.C. 치버, 바로 그의 아버지이다. 헉은 어머니를 버린 아버지와 현재 소원한 관계이다. 한편, 헉은 베이커스필드 출신의 젊은 싱어, 빌리 오퍼에게 사랑의 감정을 느끼는데, 문제는 헉과 빌리가 너무나도 다른 스타일이라는 것. 본능적으로 지나치게 감정표현을 자제하고 장기적인 관점에서 사람들을 대하지 않는 헉과 달리, 빌리는 주위사람들과 감성적으로 교감을 나누고 그들의 고통을 치유하려 애쓰는 스타일. 세계대회에서 우승하고, 빌리와의 사랑을 성취하기 위해서는, 자신의 라이프 스타일로 포커 게임을 치고, 즐겁게 포커 게임을 하는 방식으로 삶을 살아야함을 헉은 뒤늦게 깨닫는데...",https://images.justwatch.com/poster/240916042/s276/lucky-you.webp,"[('Naver Store', ['₩4,950', 'HD'])]"
언더독,Underdog,(2007),,,"['57%', '4.8 (21k)']","['코미디 , 판타지 , 가족 , SF , 액션']",['1시간 21분'],['Frederik Du Chau'],"['Jason Lee', 'Jim Belushi', 'Patrick Warburton', 'John Slattery', 'Peter Dinklage', 'Brad Garrett', 'Taylor Momsen', 'Amy Adams', 'Alex Neuberger', 'Larry Vigus', 'Bates Wilder', 'Frank Ridley', ""Alexander 'Alex' Garde"", 'Diana Shneider', 'Samantha Bee', 'John Franchi', 'Ezra Buzzington']","미치광이 과학자 사이몬 바시니스터의 실험실에서 사고가 발생한다. 이 사고로 인해 마침 실험실에 실험용으로 잡혀 있던 비글 강아지 ‘슈샤인’이 슈퍼 파워를 가지게 된다. 슈샤인은 자신의 놀라운 능력으로 인해서 사람과 말을 할 수 있게 될 수 있는 것은 물론 망토를 걸친 슈퍼 히어로 강아지 ‘슈퍼독’으로 변신하게 된다. 그후, 슈퍼독은 시민들을 보호하고 스파니엘 강아지 폴리의 사랑을 얻기 위해 맹활약하면서, 시민들의 사랑도 한 몸에 받게 된다. 그러던 중, 사이몬은 그의 부하 캐드와 함께 캐피톨 시를 파괴하려는 음모를 계획한다. 이들의 계획을 제지할 수 있는 것은 오직 우리의 귀염둥이 영웅 슈퍼독 뿐! 슈퍼독은 잭과 함께 이들의 음모를 막기 위해 최선을 다하는데...",https://images.justwatch.com/poster/9664346/s276/underdog.webp,"[('Naver Store', ['₩5,500', 'HD'])]"
