제목,원제,개봉일,스트리밍,대여,평점,장르,재생 시간,감독,출연진,시놉시스,이미지,구매
다섯 개의 시선,,(2006),"[('Watcha', ['정액제', 'HD'])]",,"['69%', '6.6']",['드라마'],['1시간 52분'],"['Jung Ji-woo , Kim Dong-won , Ryoo Seung-wan , Park Kyung-hee , Jang Jin']","['Kim Su-hyun', 'Ahn Kil-kang', 'On Ju-wan', 'Ryu Seung-ryong', 'Gong Ho-seok', 'Seo Ju-hee', 'Shin In-sook', 'Kwon Hyeong-joon', 'Lee Jeong-heon', 'Oh Tae-kyung', 'Lee Jin-sun', 'Lee Jae-yong', 'Yim Soon-rye', 'Kim Young-ae']","국가인권위원회가 기획/제작한 옴니버스 영화. 다섯 명의 감독이 참여했다. 탈북 청소년, 장애인, 비정규직, 중국동포 등 사회적 약자, 소수자에 대한 사회적 무관심과 일상화된 차별문제를 다뤘다. 장애인 소녀가 직접 출연하여 그 일상을 담담하게 보여주거나, 이미 죽고 없는 주인공을 대신한 카메라가 이야기를 쫓아가거나, 가해자의 의식을 들추기도 하는 등 다양한 방식으로 제작됐다. 인권과 차별에 관한 다양한 이야기, 작가의 시선을 통해 궁극적으로 우리 사회의 인권 감수성을 드높이고자 기획됐다.",https://images.justwatch.com/poster/194770712/s276/if-you-were-me-2.webp,"[('Naver Store', ['₩2,000'])]"
유감스러운 도시,,(2009),"[('Watcha', ['정액제', 'HD'])]","[('wavve', ['₩1,540', 'HD']), ('Naver Store', ['₩1,540', 'HD'])]","['62%', '6.5']","['코미디 , 액션']",['2시간 1분'],['Kim Dong-won'],"['Jung Joon-ho', 'Jung Woon-taek', 'Kyeong-hoon Jeong', 'Jung Woong-in', 'Jeon Mi-seon', 'Sunwoo Jae-duk', 'Park Sang-min']","강력계 근성이 숨쉬고 있는 교통 경찰 ‘장충동’. 외부에 얼굴이 알려지지 않았다는 이유로 특수수사팀에 합류, 기업형 거대 조직의 새내기 조직원으로 잠입하는 일생일대의 특수 임무를 맡게 된다. 일명 ‘대가리’라 불리는 ‘문동식’의 수하가 되어 갖은 구박을 받던 ‘충동’은 특수수사팀의 계획적인 도움으로 조직의 보스 ‘양광섭’의 목숨을 구하고, 조직의 수뇌부로 인정받으며 급부상하게 된다. 한편 조직에서도 특수수사팀의 수사망을 피하기 위해 위장 잠입시킬 인재를 찾고 ‘이중대’가 그 임무를 맡게 된다. 물론, 얼굴이 알려지지 않았다는 이유로…. ‘중대’는 조직원이었을 때의 경험(?)을 십분 발휘해 강력계 사건들을 속속 해결하며 특수수사팀에 합류하게 된다. 그리고 내사과 ‘차세린’ 경위와 사랑에 빠지게 되고 이를 눈치 챈 조직의 2인자 ‘쌍칼’의 감시를 받게 된다. 경찰에서 조직원으로, 조직원에서 경찰로 모든 것이 바뀌어 버린 ‘장충동’과 ‘이중대’는 조직의 러시아 밀거래를 앞두고 속고 속이는 본격적인 임무수행을 시작하는데…. 물 만난 고기처럼 완벽하게 역할체인지 완료! 과연 그들은 본성을 숨기고 아슬아슬한 특수임무를 끝마칠 수 있을까??..",https://images.justwatch.com/poster/139054995/s276/yugamseureoun-dosi.webp,"[('wavve', ['₩6,050', 'HD']), ('Naver Store', ['₩6,050', 'HD'])]"
사랑,,(2007),"[('wavve', ['정액제', 'HD']), ('Watcha', ['정액제', 'HD'])]","[('wavve', ['₩1,200', 'HD']), ('Naver Store', ['₩1,400', 'HD'])]","['65%', '6.7']","['액션 , 드라마']",['1시간 44분'],['Kwak Kyung-taek'],"['Joo Jin-mo', 'Park Si-yeon', 'Joo Hyun', 'Kim Min-jun', 'Lim Hyun-sung', 'Cha Do Jin', 'Kwak In-joon', 'Lee Hwi-hyang', 'Kim Kwang-kyu', 'Hong Seok-Yeon', 'Bae Kwang-won', 'Yoon Jae']","평범하게 꼭 남들만큼만 살고 싶었던 남자, 채인호. 평생 지켜주겠다는 첫사랑 그녀를 향한, 열 일곱의 수줍은 맹세를 지키기 위해 악랄한 건달 치권의 목에 칼을 꽂았다. 7년 후, 버릴 수 없는 그 여자는 가질 수 없는 사랑이 되어 나타나고... 지독하게 조여 오는 운명을 상대로 한, 거친 남자의 뜨거운 삶이 시작된다!",https://images.justwatch.com/poster/40161886/s276/a-love.webp,"[('Naver Store', ['₩3,500', 'HD'])]"
페이지 터너,La tourneuse de pages,(2006),,,"['75%', '7.0 (7k)']","['드라마 , Made in Europe , 음악 , 스릴러']",['1시간 25분'],['Denis Dercourt'],"['Catherine Frot', 'Déborah François', 'Pascal Greggory', 'Christine Citti', 'Clotilde Mollet', 'Jacques Bonnaffé', 'Xavier de Guillebon', 'Antoine Martynciow', 'André Marcon', 'Julie Richalet', 'Martine Chevallier', 'Arièle Butaux', 'Michèle Ernou', 'Danièle Douet', 'Mark Reed', 'Jean Chrétien', 'François Rosolato', 'Alexis Monceaux', 'Jacques Sotty', 'Catherine Lebaigue', 'Frédéric Moulin', 'Émilie Reignier', 'Marion Sicre', 'Pomme Bourcart', 'Juliette Bône', 'Caroline Mathieu', 'Moussa Ag Assarid', 'Karim Adelis', 'Danièle Renaud', 'Julie Primot', 'François Guillaume']","가난하지만 피아니스트를 꿈꾸는 소녀 멜라니. 그녀는 부모님에게 반드시 유명 음악학교에 합격하겠다고 약속한다. 하지만 시험장에서 심사위원장인 아리안의 행동 때문에 정신이 산만해진 멜라니는 연주를 망치고 결국 피아니스트의 꿈을 접는 아픔을 겪게 된다. 10년 후, 멜라니는 아리안 남편의 회사 인턴이 되고 아들의 가정교사로 아리안의 집으로 들어가지만 아리안은 그녀를 전혀 기억하지 못하고, 오히려 멜라니에게 혼자서는 피아노 연주가 힘들다며 악보 넘기는 일을 부탁한다. 페이지 터너의 일을 완벽하게 수행하며 아리안의 든든한 보조자로 인정받은 멜라니... 하지만 무표정한 얼굴 뒤로 서서히 10년 전 자신의 꿈을 망친 아리안을 향한 복수를 시작하는데...",https://images.justwatch.com/poster/171641047/s276/the-page-turner.webp,"[('Naver Store', ['₩1,000'])]"
극장판 천원돌파 그렌라간: 홍련편,天元突破グレンラガン 紅蓮篇Gekijouban Tengen Toppa Gurren Lagann: Gurren-hen,(2008),"[('wavve', ['정액제', 'HD']), ('Watcha', ['정액제', 'HD'])]","[('wavve', ['₩1,500', 'HD'])]","['82%', '7.7 (1k)']","['액션 , 애니메이션 , 드라마 , SF , 코미디']",['1시간 52분'],['Hiroyuki Imaishi'],"['Tetsuya Kakihara', 'Katsuyuki Konishi', 'Marina Inoue', 'Yukari Fukui', 'Nobuyuki Hiyama', 'Mitsuki Saiga', 'Masaya Onosaka', 'Michiko Neya', 'Kiyoshi Kawakubo', 'Akio Suyama', 'Shizuka Itoh', 'Takako Honda', 'Kisho Taniyama', 'Rina Sato', 'Kana Ueda', 'Kana Asumi', 'Daiki Nakamura', 'Narushi Ikeda', 'Nobuyuki Hiyama', 'Daisuke Kirii', 'Kiyoyuki Yanada', 'Takafumi Kawakami', 'Go Shinomiya', 'Takashi Kondo', 'Kouzou Douzaka', 'Katsuyuki Konishi']","먼 미래. 미증유의 재해를 피해 땅속으로 파고 들어간 인간들은 수백 년 동안 지하에서 사는 동안 지상이라는 곳이 존재한다는 사실 자체를 잊어버리고 말았다. 그런 중 한 곳에 두 남자가 있었다. 하나는 내성적인 소년 시몬, 또 하나는 지상이 있는 것을 믿어 의심치 않는 근성 청년 카미나. 어느 날 지하마을의 천정이 무너져 내렸을 때, 두 남자의 운명은 크게 요동치기 시작한다! 무너진 천정에서 떨어져 내려온 것은 거대한 얼굴을 가진 로봇 간멘과 초전도 라이플을 가진 소녀 요코, 그리고 눈부시게 쏟아져 내리는 햇빛이었다. 그리고 지상으로 뛰쳐 올라온 시몬, 카미나, 요코의 앞에는 전대미문의 모험이 펼쳐진다.",https://images.justwatch.com/poster/174794659/s276/ceonweondolpa-geurenragan-hongryeonpyeon.webp,
Bad Girls,Niñas Mal,(2007),"[('Watcha', ['정액제', 'HD'])]",,"['67%', '5.4 (2k)']","['코미디 , 가족']",['1시간 40분'],['Fernando Sariñana'],"['Martha Higareda', 'Blanca Guerra', 'Camila Sodi', 'María Aura', 'Alejandra Adame', 'Ximena Sariñana', 'Daniel Berlanga', 'Zaide Silvia Gutiérrez', 'Salvador Sánchez', 'Rafael Sánchez Navarro', ""Roberto D'Amico"", 'Mario Corona', 'Humberto Busto', 'Víctor González', 'Diana Golden', 'Verónica Langer', 'Jorge Luis Moreno']",A rebellious teen butts heads with the teachers at an all-girl charm school in Mexico City.,https://images.justwatch.com/poster/242191592/s276/ninas-mal.webp,"[('Naver Store', ['₩1,200', 'HD'])]"
"열세살, 수아",,(2007),"[('Watcha', ['정액제', 'HD'])]",,"['67%', '6.9']",['드라마'],['1시간 35분'],['Kim Hee-jung'],"['Kim Yoon-ah', 'Chu Sang-mi', 'Lee Se-young', 'Jin-an Jeong']","초등학교를 졸업하고 중학교 교복을 입는 나이 열세살. 수아는 아버지가 돌아가신 후 식당을 운영하는 엄마와 단둘이 생활하고 있다. 허구한날 잔소리뿐 이제 막 사춘기에 접어든 수아가 어떤 생각을 하는 지에는 전혀 관심 없는 엄마는 수아의 가장 큰 불만이다. 그런 수아에게 유일한 즐거움은 가수 윤설영. 엄마는 숨기려 하지만, 수아는 알고 있다. 사실 수아의 진짜 엄마는 다름 아닌 윤설영이라는 것을!!",https://images.justwatch.com/poster/62046744/s276/the-wonder-years.webp,"[('Naver Store', ['₩1,000'])]"
다섯 번째 계절,Bee Season,(2005),,,"['60%', '5.5 (6k)']","['드라마 , 가족']",['1시간 44분'],"['David Siegel , Scott McGehee']","['Richard Gere', 'Juliette Binoche', 'Flora Cross', 'Max Minghella', 'Kate Bosworth', 'Corey Fischer', 'Sam Zuckerman', 'Cynthia Lea Clark']","엘리자 나우먼은 철자 맞추기의 천재다. 수많은 단어들, 어려운 단어, 긴 단어를 말끔하게 소화해내는 그녀를 보고 주위사람들은 놀라지 않을 수 없다. 특히, 가족들은 그녀의 천재적인 재능으로 인해 돌이킬 수 없이 삶이 바뀌게 된다. 은 겉으로는 완벽해 보이지만, 그 이면에는 비밀스러운 혼란에 휩싸인 현대 가족의 변화무쌍한 모습을 보여준다. 엘리자 나우먼이 '철자 맞추기 경연대회'의 최고 권위를 자랑하는 워싱턴에서 열릴 전국 대회를 준비하면서, 그녀의 가족들은 서서히 무너지기 시작한다. 어려운 단어를 마스터하게 될수록, 그녀 주위의 커뮤니케이션은 점점 어려워진다. 종교학부 교수인 아빠 사울은 딸의 뛰어난 재능에서 초자연적인 무언가를 보게 되고, 카발라 종교의 비밀을 가르치기 시작한다. 그는 엘리자가 과거 유대교 선지자들만이 가졌던 특별한 능력인 신과 소통할 수 있는 예지력을 가졌을 것이라 믿고 그녀의 철자경연대회 우승에 점점 더 크게 집착하게 된다. 그녀가 더 큰 재능을 보여줄 수록 신에게 더 가까이 다가가는 것이라 생각하는 사울은 딸을 통해 자기가 하고 싶었던 일에 대해 대리만족을 느끼는 것이다. 한편, 엘리자의 엄마 미리엄은 둘의 모습을 보며 한때 자신이 남편과 가졌던 관계와 어린 시절 비극적으로 죽은 부모님과 나누었던 아픈 관계를 회상하고 정신적으로 무너져간다. 한때 아버지의 사랑을 듬뿍 받았던 엘리자의 오빠 애론은 달라진 아빠에 대한 반항심으로 아빠가 용납할 수 없는 다른 종교에 심취하게 된다. 그리고, 아빠의 지나친 기대와 무너져 버린 가족들 가운데에서 엘리자는 조용히 자기가 할 수 있는 최선의 선택을 하려고 한다. 과연 9살의 작은 소녀는 자신의 가족을 다시 예전처럼 행복하게 되돌릴 수 있을까?",https://images.justwatch.com/poster/30562290/s276/bee-season.webp,"[('Naver Store', ['₩5,500', 'HD'])]"
8인: 최후의 결사단,十月圍城,(2009),"[('Watcha', ['정액제', 'HD'])]","[('wavve', ['₩1,200', 'HD'])]","['73%', '6.8 (7k)']","['드라마 , 액션 , 역사']",['2시간 19분'],['Teddy Chan'],"['Donnie Yen', 'Wang Xueqi', 'Tony Leung Ka-fai', 'Nicholas Tse', 'Hu Jun', 'Eric Tsang', 'Chris Lee', 'Fan Bingbing', 'Zhou Yun', 'Mengke Bateer', 'Wang Bo-chieh', 'Leon Lai', 'Jacky Cheung', 'Michelle Reis', 'Simon Yam', 'Cung Le', 'Zhang Hanyu', 'John Shum Kin-Fun', 'Zhang Xiang']","쑨원이 혁명가들과 비밀리에 모임을 갖기 위해 홍콩에 도착하던 1906년 10월 15일. 미리 정보를 입수한 수백 명의 자객들이 그를 암살하기 위해 홍콩에 잠입하고, 이를 알게 된 ‘혁명가’는 막강한 자금력으로 그를 뒷받침해주는 오랜 친구 ‘대부호’를 설득해 쑨원을 지키기 위한 계획을 세운다. 대부호를 향한 충성심으로 가득한 인력거꾼과 자객들에게 아버지를 잃은 극단단원, 거구이지만 마음은 상냥한 두부장수, 과거의 아픔 때문에 스스로를 버렸던 걸인, 대부호의 아들이자 아버지의 뜻을 거슬러 위험한 임무에 가담한 후계자까지. 얼굴도 이름도 모르는 영웅을 지키기 위해 호위대를 결성한 이들에게 평범한 모습 속에 뛰어난 무술 실력을 감추고 살아 온 숨은 고수 도박꾼이 마지막으로 합류한다. 목숨을 내건 이들의 계획은 쑨원이 비밀 모임을 갖는 한 시간 동안 그를 가장한 인물을 태우고 암살자들이 둘러싼 시내 한복판으로 뛰어들어 함정을 만드는 것. 하지만 8인의 호위대가 막아내야 하는 암살자는 수백 명에 달하고, 영웅을 지키기 위해 스스로 표적이 된 이들은 암살자들을 따돌리기 위한 필사적인 사투를 벌인다.",https://images.justwatch.com/poster/187617937/s276/bodyguards-and-assassins.webp,"[('Naver Store', ['₩1,000', 'HD'])]"
하프 라이트,Half Light,(2006),"[('wavve', ['정액제', 'HD']), ('Watcha', ['정액제', 'HD'])]","[('wavve', ['₩1,200', 'HD'])]","['66%', '6.0 (13k)']","['스릴러 , 공포 , 로맨스 , 드라마 , Made in Europe']",['1시간 50분'],['Craig Rosenberg'],"['Demi Moore', 'Henry Ian Cusick', 'Jordan El-Balawi', 'Kate Isitt', 'Nicholas Gleaves', 'James Cosmo', 'Joanna Hole', 'Therese Bradley', 'Hans Matheson', 'Mickey Wilson', 'Polly Frame', 'Ceit Kearney', 'Nichola Bee', 'Jamie Edgell', 'Anne Smith']","그 애가 떠나고… 모든 것이 어긋나기 시작했다.어느 때와 다름 없던 평온한 하루, 레이첼은 아들이 익사하는 사고를 목격하고 만다. 잘 나가는 베스트 셀러 작가였던 레이첼은 아들의 죽음에 대한 충격으로 글도 쓰지 못하고 남편과의 관계마저도 소원하게 된다. 물가로 이어진 문을 열어 두어 아들을 죽음으로 내몰았다는 자책감을 떨칠 수 없는 그녀는 결국 살던 곳을 떠나 한적한 교외로 거처를 옮기고 바다가 한 눈에 내다 보이는 아름다운 자연에 마음을 기댄 채 새롭게 시작할 수 있을 것이라고 다짐하는데,,,흔적이 사라진 만남, 아무도 나를 믿지 않는다.신작을 구상하던 레이첼은 자료 조사를 위해 찾은 외딴 섬에서 자신과 마찬가지로 사랑하는 사람을 잃은 아픔을 지닌 앵거스를 만나 마음의 안정을 찾기 시작한다. 그러나 마을 사람들은 앵거스는 이미 7년 전에 죽은 사람이라고 얘기하는데,,, 마을 사람들이 무엇인가를 숨기고 있다는 느낌을 받은 레이첼은 앵거스와의 만남을 증명하려 하지만 그와의 흔적은 어디에도 찾을 수가 없고 계속해서 나타나는 죽은 아들의 영혼은 그녀를 더욱 혼란에 빠뜨린다. 그러던 어느날, 레이첼은 자신의 집에 숨겨져 있던 사진 한 장을 발견하고 자신을 둘러싼 비밀에 접근하기 시작하는데,,,,",https://images.justwatch.com/poster/135651209/s276/half-light.webp,"[('Naver Store', ['₩500', 'HD'])]"
Deal,,(2008),"[('wavve', ['정액제', 'HD']), ('Watcha', ['정액제', 'HD'])]","[('wavve', ['₩1,200', 'HD'])]","['60%', '5.4 (4k)']","['드라마 , 코미디 , 스릴러']",['1시간 25분'],['Gil Cates Jr.'],"['Burt Reynolds', 'Bret Harrison', 'Shannon Elizabeth', 'Maria Mason', 'Gary Grubbs', 'Caroline McKinley', 'Charles Durning', 'Brandon Ray Olive', 'Jennifer Tilly', 'Jon Eyez', 'J.D. Evermore', 'Mike Sexton', 'Vincent Van Patten', 'Phil Laak', 'Antonio Esfandiari', 'Courtney Friel', 'Scott Lazar', 'Isabelle Mercier', 'Chris Moneymaker', 'Joe Hachem', 'Greg Raymer', 'Wallace Merck', 'Dustin Hunter Evans', 'Floyd Lewis', 'Evelyn Mullins', 'Neal Rivet', 'Marcus Stanley', 'Preston Lorio', 'Kenny Bordes', 'Tatyana Kanavka', 'Lawrence P. Beron', 'Tony Bentley', 'Rio Hackford', 'Summer Lee', 'Tommy Perna', 'Lyle Brocato', 'Ritchie Montgomery', 'Sherri Marina', 'Michael Arata', 'Amanda Columbus', 'John Lambremont Jr.', 'Billy Slaughter']","As an ex-gambler teaches a hot-shot college kid some things about playing cards, he finds himself pulled into the world series of poker, where his protégé is his toughest competition.",https://images.justwatch.com/poster/256395372/s276/deal.webp,"[('Naver Store', ['₩1,000', 'HD'])]"
아르헨티나 할머니,アルゼンチンババア,(2007),"[('Watcha', ['정액제', 'HD'])]",,"['63%', '5.9']","['드라마 , 코미디']",['1시간 51분'],['Naoki Nagao'],"['Koji Yakusho', 'Maki Horikita', 'Kyoka Suzuki', 'Satomi Tezuka', 'Ittoku Kishibe', 'Naoki Tanaka']","마법처럼 다가온 행복 바이러스 행복한 공기로 가득한 아르헨티나 빌딩으로 놀러오세요 우리 동네엔 어디서 왔는지 모를 괴짜 여인이 한 명 살고 있어요. 그녀의 아지트 근처를 지날 때면 한번도 맡아본 적이 없는 지독한 냄새를 풍기고 옥상에서 머리를 풀어헤친 채 탱고를 추는 이 여인. 우리는 그녀를 아르헨티나 할머니라 부릅니다. 어렸을 적부터 그녀는 두려움의 대상이었죠. 애들을 잡아다가 집에서 키우는 고양이 밥으로 해 먹인다는 무시무시한 얘기도 오갔고요. 18살이 되던 해, 그만 엄마가 병으로 세상을 떠나셨어요. 이 와중에 아빠는 엄마의 임종도 지키지 않고 어디론가 사라져 버리셨죠. 너무나 슬퍼 잠시 그럴 거라 생각했는데, 무슨 잠적을 6개월이나 할까요? 아빠 찾으러 다니는 것도 지쳐갈 무렵, 아빠가 아르헨티나 할머니 집에서 그녀와 함께 있다는 소문을 듣고 거의 쓰러질 뻔했습니다. 고양이 밥이 될 거란 두려움도 무릅쓰고 찾아간 그 집. 그 곳에 아빠는 정말 있었습니다. 아빠는 그 곳에서 뭔가를 열심히 만들고 계셨고 그것의 이름은 '만다라'라고 하더군요. 무슨 에로영화 이름 같은 그것을 만들면서 아빠는 마음의 상처를 달래는 것 같았어요. 아르헨티나 할머니의 극진한 대접을 받으면서요. 6개월 동안 아빠와 그녀 사이엔 도대체 무슨 일이 있었던 걸까요? 계속 이 집에 드나들면서 그 비밀을 캐봐야겠어요",https://images.justwatch.com/poster/138742077/s276/areuhentina-halmeoni.webp,
도마뱀,,(2006),"[('Watcha', ['정액제', 'HD'])]","[('wavve', ['₩1,540', 'HD']), ('Naver Store', ['₩1,540', 'HD'])]","['76%', '6.9']","['로맨스 , 드라마 , 코미디']",['1시간 57분'],['Kang Ji-eun'],"['Kang Hye-jung', 'Cho Seung-woo', 'Lee Jae-yong', 'Byeon Ju-Yeon', 'Park Gun-tae', 'Jung Jin-young', 'Chung Sung-hwa', 'Kang Shin-il', 'Park Shin-hye']","구름 한 점 없이 맑은 날, 학교로 향하는 조강 앞에 노란색 우비를 입은 소녀 아리가 나타난다. 아리를 본 순간 조강은 찌릿찌릿 전기가 통하는 것을 느끼고 신기하게도 둘은 같은 반 짝궁이 된다. 자신은 지구인이 아니라서 노란 우비를 입어야 저주를 막을 수 있다며 당돌하게 말하는 아리. 그런 아리가 무서운지 아이들은 피하기 바쁘지만 조강만은 그녀의 든든한 짝이 되어 준다. 이제껏 도마뱀만이 유일한 친구였던 아리에게 처음으로 조강이라는 친구가 생긴 것이다. 소나기가 내리던 어느 날, 아리는 비에 젖은 조강과 우비를 나눠 쓰고 처음으로 살이 닿는다. 다음날 조강은 홍역을 앓고, 아리는 연기처럼 사라져 버린다. 그렇게, 연락이 끊긴 채 10년이라는 세월이 흐른다. 10년이 지나 어느덧 고2가 된 아리와 조강. 갑자기 연락해 온 아리를 보기 위해 조강은 공부를 핑계 삼아 암자로 찾아가고, 십년이란 세월이 무색할 정도로 둘은 즐거운 시간을 보낸다. 집으로 돌아가기 전날 밤, 조강은 절에서만 지내는 아리를 위해 서울에서 초밥을 가져와 선물하고, 그런 모습에 아리는 깊이 감동하지만 다음날 또다시 연기처럼 사라져 버린다. 아리가 말없이 사라진 후, 또다시 긴 시간이 흐르고 조강은 은행원 직원이 되어있다. 탐정까지 고용해 아리를 찾아봤지만 흔적도 없다. 그러던 어느날 아리가 조강 앞에 나타난다. 환한 미소로, 마치 어제 만났던 사람처럼... 당황스럽고 기쁜 기분도 잠시, 8년만에 나타나 8시간을 함께 보내고 그녀는 미국으로 떠난다고 한다. 그녀를 바래다 주던 공항에서 조강은 차마 아리를 잡지 못한다. 다음날, 조강은 아리를 닮은 여자를 발견하지만 그녀는 조강을 알아보지 못한다. 그런 그녀를 보고 조강은 혼돈에 빠지는데… 그녀는 왜 자꾸 떠나기만 하는 걸까? 아리와 조강은 다시 만날 수 있을까? 두 사람에겐 과연 무슨 일이 벌어지는 걸까?",https://images.justwatch.com/poster/243962805/s276/love-phobia.webp,"[('wavve', ['₩6,050', 'HD']), ('Naver Store', ['₩6,050', 'HD'])]"
"러블리, 스틸","Lovely, Still",(2008),"[('Netflix', ['정액제', 'HD']), ('Watcha', ['정액제', 'HD'])]","[('wavve', ['₩1,000', 'HD'])]","['75%', '7.1 (2k)']","['드라마 , 로맨스']",['1시간 32분'],['Nicholas Fackler'],"['Martin Landau', 'Ellen Burstyn', 'Adam Scott', 'Elizabeth Banks', 'Har Mar Superstar', 'Kali Cook', 'Chris Wiig', 'M. Michele Phillips', 'Tina Dixon', 'Mary Douglass', 'Scott Beehner', 'Todd Fink', 'Ross Brockley', 'Alex Curbeam', 'Michael Leach Jr.', 'Nick Hernandez', 'Leo Fitzpatrick', 'Judith Kathryn Hart', 'Jules Blight', 'Mark Booker', 'Mark Kresl', 'Zoey Newman', 'James Devney', 'Melissa Jarecke', ""Sean O'Connell"", 'Randi-Shane Knox']","감성을 촉진하는 엣지 로맨스가 시작 된다!!! 노총각계의 전설, 엣지있는‘로버트’언제나 규칙적인 생활패턴과 흐트러짐이 없는 그에게 당돌한 여자'메리'가 나타났다. 당돌하지만 너무나 사랑스러운 ‘메리’첫 만남부터 다짜고짜 데이트를 신청하면서 달려드는 그녀. 거부할 수 없는 메리의 매력에 빠진 로버트는 생애 첫 데이트를 하게 된다. 완벽주의 엣지 노총각답게 함께 일하는 동료들에게 첫 데이트 노하우를 전수받고 모든 준비를 마친 ‘로버트’ 생애 첫 데이트에 마냥 설레기만한‘로버트’와 신비로운 ‘메리’의 엣지 로맨스가 시작된다. 하지만 그녀에게는 로버트가 모르는 엄청난 비밀이 숨겨져 있는데..... 우리의 순진남 '로버트'의 첫 데이트는 과연 성공?!",https://images.justwatch.com/poster/11274412/s276/lovely-still.webp,"[('Naver Store', ['₩1,000', 'HD'])]"
원탁의 천사,,(2006),,"[('wavve', ['₩1,200', 'HD'])]","['58%', '6.8']","['판타지 , 코미디']",['1시간 45분'],['Kwon Sun-Guk'],"['Lee Min-woo', 'Haha', 'Ahn Kil-kang', 'Jo Dal-hwan', 'Kim Sang-joong', 'Lee Han-wi', 'Im Ha-ryong', 'Kim Bo-Yeon', 'In Gyo-jin', 'Yoo Chae-mok', 'Jung Si-a']","사기전과로 교도소 복역 중인 영규(임하룡)는 출소 전날, 조폭두목 장석조(김상중)의 강압에 못이겨 발야구를 하다가 뇌진탕으로 죽게 된다. 출감 후 아들 원탁(이민우)에게 최고의 아빠로 거듭나겠다는 꿈도 못 이룬 채 사망한 영규. 죽은 것도 억울한데 그를 찾아온 천사는 일 많다고 빨리 천국에 가자고 종용한다. 하지만 천국보다 아들이 더 소중한 영규는 아들에게 좋은 아빠로 남고 싶다며 ‘잠시만이라도 우리 원탁이의 가장 친한 친구가 되보고 싶다’ 고 말한다. 말이 씨가 된다고 했던가. 천사는 그의 소원을 말 그대~로 이뤄준다. 중년의 아빠 영규를 고딩 동훈이(하동훈)로 환생시켜버린 것이다. 한편, 천사에겐 영규 외에 거둬야 할 영혼이 또 하나 있었으니 그는 바로 영규의 감방동기, 장석조. 억세게 운 나쁘게 세상을 떠난 영규와는 달리 위풍당당하게 교도소 문을 나선 장석조는 조직이 완전히 와해된 사실을 알게 된다. 그에게 남은 것은 두뇌회전 안되는 부하 3명뿐. 석조는 믿을 수 없는 현실에 부들부들 떨며 80년 형 각 그랜저를 몰다가 폭주족들과 다툼을 벌이고 교통사고로 사망직전에 이른다. 이제 천사는 석조의 영혼을 온전히 거두면 임무완수! 하지만 그는 영규의 간곡한 부탁을 돕기 위해 석조의 육체를 빌어 고딩이 된 영규, 즉 하동훈의 인생에 개입하기 시작한다.",https://images.justwatch.com/poster/198122407/s276/weontagyi-ceonsa.webp,"[('Naver Store', ['₩1,200', 'HD'])]"
