제목,원제,개봉일,스트리밍,대여,평점,장르,재생 시간,감독,출연진,시놉시스,이미지,구매
어느날 갑자기 첫번째 이야기: 2월 29일,,(2006),"[('Watcha', ['정액제', 'HD'])]","[('wavve', ['₩1,540', 'HD']), ('Naver Store', ['₩1,540', 'HD'])]","['62%', '5.7']","['공포 , 스릴러']",['1시간 30분'],['Jung Jong-hoon'],"['Park Eun-hye', 'Eun-jin Baek', 'Myeong-jin Lee', 'Detective Park', '(uncredited)']","고속도로 톨게이트 매표원인 지연은 비 오는 날 새벽 2시가 되면 찾아오는 기분 나쁜 냄새를 품은 차량에서 내미는 티켓을 받으며 몸서리를 친다. 비오는 새벽 음습한 기운과 함께 그 검은 차가 통과하게 되면 근처 톨게이트 매표원의 살인사건이 발생하게 되고. 지연은 점점 살인사건이 발생하는 톨게이트가 자신이 근무하는 톨게이트와 가까워 진다는 사실을 알게 되는데... 경찰들과 함께 야간근무를 서는 어느날 비 오는 새벽, 다시금 그 검은 차량이 다가온다. (제목은 4년에 한번씩 찾아오는 윤달 29일을 의미)",https://images.justwatch.com/poster/12233237/s276/4-horror-tales-february-29.webp,"[('wavve', ['₩6,050', 'HD']), ('Naver Store', ['₩6,050', 'HD'])]"
Pompeii,Pompei,(2007),,"[('wavve', ['₩2,000', 'HD'])]",['64%'],"['역사 , 로맨스']",['3시간 6분'],['Giulio Base'],"['Lorenzo Crespi', 'Andrea Osvárt', 'Maria Grazia Cucinotta', 'Massimo Venturiello', 'Maurizio Aiello', 'Fabrizio Bucci']","Forbidden love blossoms in the city of Pompeii, which until the eruption of volcano Vesuvius in 79 AD, is one of the empire's most powerful cities.",,"[('Naver Store', ['₩1,000', 'HD'])]"
내 생애 가장 아름다운 일주일,,(2005),"[('Netflix', ['정액제', 'HD']), ('Watcha', ['정액제', 'HD'])]","[('wavve', ['₩1,540', 'HD']), ('Naver Store', ['₩1,540', 'HD'])]","['69%', '6.7']","['드라마 , 로맨스']",['2시간 9분'],['Min Kyu-dong'],"['Uhm Jung-hwa', 'Hwang Jung-min', 'Cheon Ho-jin', 'Im Chang-jung', 'Seo Young-hee', 'Yoon Jin-seo', 'Kim Su-ro', 'Jung Kyung-ho', 'Joo Hyun', 'Oh Mi-hee', 'Jin Tae-hyeon', 'Ha Ji-won', 'Kim You-jung', 'Kim Yoon-seok', 'Jeon Hye-jin', 'Jeong Yoon-min', 'Lee Se-young', 'Ryu Seung-su', 'Jung Kyung-ho', 'Jo Hee-bong', 'Woo Hyeon', 'Lee Hwan', 'Kim Tae-yong', 'Lee Byung-joon', 'Han Sang-jin', 'Hwang Hyo-eun', 'Kim Dong-wook']","각기 다른 여섯 커플의 사랑을 일주일이라는 한정된 시간 안에서 '다중스토리 구조'라는 형식을 통해 보여주는 영화. 임창정은 '지하철에서 물건을 팔며 어렵게 생활하지만 밝고 긍정적인 캐릭터'인 창후 역으로, 엄정화는 깐깐하고 도도한 정신과 의사로 분해 단순무식 과격하지만 여자에겐 쑥맥인 노총각 형사와 팽팽하고 아슬아슬한 사랑 줄다리기를, 주현은 '20년째 단관 극장을 운영하며 지내는 고집불통 구두쇠' 곽회장 역할을, 김수로는 어린 꼬마 연인과의 매우 색다른 사랑을 선보인다.",https://images.justwatch.com/poster/191776229/s276/all-for-love.webp,"[('wavve', ['₩6,050', 'HD']), ('Naver Store', ['₩6,050', 'HD'])]"
InAlienable,,(2008),"[('wavve', ['정액제', 'HD']), ('Watcha', ['정액제', 'HD'])]","[('wavve', ['₩1,000', 'HD'])]","['36%', '3.4']","['SF , 스릴러']",['1시간 46분'],['Robert Dyke'],"['Richard Hatch', 'Walter Koenig', 'Alan Ruck', 'Gary Graham', 'Erick Avari', 'Andrew Koenig', 'Priscilla Garita', 'Courtney Peldon', 'Patricia Tallman', 'Philip Anthony-Rodriguez', 'Jett Patrick', 'Gary Graham', 'Jay Acovone', 'Steven Isrish', 'Matt Lasky', 'Debra Christofferson', 'Bonnie Aarons', 'Ashley Walsh', 'Danielle Koenig', 'Brandon Ford Green', 'Judy Levitt', 'Marina Sirtis', 'Randy E. Barnett', 'Lisa LoCicero', 'Amanda Chism', 'Jeremy Clark', 'Trhea Danae', 'Ali Fussell', 'Debra Lynn Hull', 'Jennifer Gabbert', 'Frances Emma Jenkins', 'Jolene Merryman', 'Laura Molina', 'Robert Olding']","Still guilt-ridden over the accident that took his family's lives, Eric Norris discovers that his body is host to a parasite from another world. Except, it is more than a parasite: it carries his DNA.",https://images.justwatch.com/poster/205562129/s276/inalienable.webp,"[('Naver Store', ['₩1,000', 'HD'])]"
더 게임,,(2008),,"[('wavve', ['₩1,500', 'HD'])]","['67%', '6.6']","['스릴러 , 드라마']",['1시간 56분'],['Yoon In-Ho'],"['Shin Ha-kyun', 'Byun Hee-bong', 'Lee Hye-young', 'Son Hyun-joo', 'Lee Eun-sung', 'Hyuk Kim', 'Han Jae-young', 'Jang Hang-seon']","공원에서 사람들의 초상화를 그려주는 거리의 화가 민희도는 가난하지만 사랑하는 연인 은아와 함께라면 작은 일상마저 소중하다고 느끼는 평범한 청년. 어느 날, 그에게 정체불명의 전화가 걸려온다. 그리고 비밀스럽고 거대한 저택으로 초대된 그에게 금융계의 큰 손이라 불리는 강노식은 거액이 걸린 일생 일대의 내기를 제안한다. 그의 무모한 제안에 흔들리던 희도는 결국, 사랑하는 사람과 행복했던 자신의 평범한 일상을 지키기 위해 노식의 제안을 받아들이고 인생을 건 최대의 도박을 시작한다.",https://images.justwatch.com/poster/11928758/s276/deo-geim-2008.webp,"[('Naver Store', ['₩1,500', 'HD'])]"
Battlespace,,(2006),,"[('wavve', ['₩1,000', 'HD'])]",['57%'],['SF'],['1시간 27분'],['Neil Johnson'],"['Blake Edgerton', 'Eve Connelly', 'Paul Darrow', 'Iva Franks Singer', 'Spencer Slasberg', 'Claire Kelly', 'Tim Shaw', 'Neil Johnson']",A futuristic sci-fi adventure begins after the destruction of their Universe. With a militaristic race of modified humans in hot pursuit Colonel Mara Shryyke finds herself stranded on an inhospitable planet and discovers a weapon of mass destruction set to destroy her home planet in less then 42 hours!,https://images.justwatch.com/poster/176071230/s276/battlespace.webp,"[('Naver Store', ['₩1,000', 'HD'])]"
카페 느와르,,(2009),,"[('wavve', ['₩1,200', 'HD'])]","['76%', '7.0']","['드라마 , 로맨스']",['3시간 21분'],['Jung Sung-il'],"['Shin Ha-kyun', 'Moon Jeong-hee', 'Kim Hye-na', 'Jung Yu-mi', 'Lee Sung-min', 'Kim Sang-kyung', 'Yozoh', 'Jung In-sun', 'Lee Yong-nyeo', 'Kim Byung-ok']","음악교사인 영수(신하균)는 같은 학교 선생 미연(김혜나)과 연인관계다. 미연에게 관심을 잃은 영수는 여행지에서 만난 학부모 미연(문정희)과 불륜관계를 맺고 운명적인 사랑에 빠지지만 이별을 통보 받는다. 이별 후 닥친 절망에 괴로워하던 영수는 거리에서 우연히 보게 된 선화(정유미)에게 호감을 느낀다. 그녀를 따라가다 쫓아 오는 치한으로부터 선화를 구해주면서, 선화의 연애에 관한 사연을 듣게 된다. 그녀의 순수와 순정에 반한 영수는 다음날 선화와 다시 만나기로 약속한다. 하지만 선화는 영수에게 자신을 절대 사랑하지 말 것을 부탁한다. 그날 이후 그녀의 사랑을 이뤄주기 위해 그녀의 편지를 남자에게 전달하고, 자신은 외로워하는 영수. 매일 같은 시간, 선화를 만나고 달빛처럼 청초하고 순수한 모습에 미소 짓지만, 결국 그녀는 떠나고 마는데……",https://images.justwatch.com/poster/114732292/s276/kape-neuwareu.webp,
박사가 사랑한 수식,博士の愛した数式,(2006),"[('wavve', ['정액제', 'HD']), ('Watcha', ['정액제', 'HD'])]","[('wavve', ['₩1,200', 'HD'])]","['77%', '7.3']","['드라마 , 가족 , 로맨스']",['1시간 57분'],['Takashi Koizumi'],"['Akira Terao', 'Eri Fukatsu', 'Ruriko Asaoka', 'Hidetaka Yoshioka', 'Hisashi Igawa', 'Takanari Saito']","최근 수년간 9명이나 되는 가정부를 갈아치운 박사는 10번째 가정부로 싱글맘인 쿄코를 소개받는다. 면접을 위해 현관에 들어간 쿄코에게 박사는 ‘자네의 구두사이즈는 몇인가?’라는 질문을 던진다. 박사는 세상의 모든 것을 숫자를 통해 풀이하는 수학자였던 것. 이것이 두 사람의 첫 만남이다. 사고로 인해 80분밖에 기억을 유지하지 못하는 박사는 매일 아침이 첫 대면이고, 언제나 숫자로 된 인사를 반복해서 나눈다. 어느날, 박사는 쿄코에게 집에서 기다리는 10살 된 아들이 있다는 것을 알게 된다. 걱정하던 박사는 학교에서 돌아오는 길에 아들도 집에 들르도록 하고, 루트(√)라는 별명을 지어준다. 두 사람은 야구라는 공통분모를 발견하고 즐거운 나날을 보내지만 루트의 야구경기를 보러 갔던 박사가 고열로 쓰러지자 3사람의 관계는 문제가 되기 시작하는데….",https://images.justwatch.com/poster/179223327/s276/bagsaga-saranghan-susig.webp,"[('Naver Store', ['₩1,200', 'HD'])]"
무영검,,(2005),"[('Watcha', ['정액제', 'HD'])]","[('wavve', ['₩1,540', 'HD']), ('Naver Store', ['₩1,540', 'HD'])]","['69%', '6.4 (2k)']","['액션 , 역사']",['1시간 57분'],['Kim Young-jun'],"['Lee Seo-jin', 'Yoon Soy', 'Lee Ki-Yong', 'Shin Hyun-joon', 'Park Sung-woong', 'Jung Ho-bin', 'Jin Bong-jin', 'Kim Su-ro', 'Jeong Jun-ha', 'Nam Ji-hyun', 'Choi Ji-woo']","926년, 발해. 거란의 침입에 의해 왕자 모두가 암살된 발해는 나라가 멸망하는 위기에 처하게 된다. 이제 발해의 마지막 희망은 어릴 적 정쟁에 휘말려 쫓겨났던 왕자 '대정현'(이서진)뿐. 이에 당대 최고의 절대 고수 '연소하'(윤소이)가 마지막 왕자를 구해야 하는 중대한 임무를 부여 받는다. '연소하'는 어릴 적부터 군영에서 자라 발해 최고의 무사로 성장한 여무장이다. 그녀는 발해의 운명을 되돌릴 마지막 희망, '대정현'을 지키기 위해 무영검을 든다. 그러나 거란 반란군의 두목 '군화평'(신현준)과 그의 심복 '매영옥'(이기용)의 숨막히는 추적이 계속되고, 가문의 복수와 자신의 야망을 위해 조국을 배신하고 거란의 앞잡이가 된 거란의 무장 '군화평'은 반드시 왕자를 찾아 암살하려는 뜨거운 복수심에 불탄다. 그의 명령이라면 목숨을 걸고 따르는 '매영옥'은 뛰어난 검술을 지닌 여자 검객 '연소하'를 꺾고 최고가 되고자 하는 질투심에 사로잡혀 끝까지 그녀를 쫓는다. 과연 발해인들의 마지막 희망 '대정현'과 '연소하'는 자신들을 쫓는 거란의 세력에 맞서 무사히 발해로 돌아올 수 있을 것인가. 발해의 재건을 위한 이들의 목숨을 건 여정과 함께 마침내 발해의 운명을 건 피할 수 없는 대결이 시작된다.",https://images.justwatch.com/poster/174370018/s276/shadowless-sword.webp,"[('wavve', ['₩6,050', 'HD']), ('Naver Store', ['₩6,050', 'HD'])]"
작업의 정석,,(2005),"[('Netflix', ['정액제', '정액제']), ('Watcha', ['HD'])]","[('wavve', ['₩1,000', 'HD'])]","['67%', '6.0 (1k)']","['로맨스 , 코미디']",['1시간 40분'],['Ki-hwan Oh'],"['Son Ye-jin', 'Song Il-gook', 'Ahn Sun-Young', 'Noh Joo-hyun', 'Park Jun-gyu', 'Yoon Young-joon', 'Hyun Young', 'Kim Ae-kyung', 'Woo Hyeon', 'Park Yong-woo']","작업계의 대표선수 민준과 지원이 만났다. 선수는 선수를 알아보는 법! 작업계의 고수로 소문난 이들에게 민준과 지원은 결코 호락호락한 상대가 아니다. 보통 남녀에게 하는 방법으로 슬쩍 서로를 떠보는 우리의 작업남녀! 하지만 이들에게 평범한 작업버전이 통할 리 없다. 드디어, 그 동안 갈고 닦은 비장의 작업기술을 실전 테스트해볼 상대를 만난 민준과 지원의 작업대결은 슬슬 달아오르기 시작한다. 드디어 적수를 만났다를 외치며 쾌재를 불렀던 두 사람. 치밀한 물 밑 작업을 거쳐 본격 작업 대결에 들어간 민준과 지원이건만, 백발백중 먹혔던 그들의 작업은 자꾸만 삑사리를 친다. 절대지존으로써 작업 내공은 무너질대로 무너지고 최고의 작업 선수라는 자부심마저 흔들리기 시작할 때! 자신만만 지원의 화려한 작업 노하우도, 여유만만 민준의 노련한 작업 테크닉도, 자연스러운 마음의 움직임을 당해낼 비법은 없음을 어렴풋이 깨달아가기 시작한다. 하지만, 진정한 프로는 승부를 보기 전까진 경기를 멈추지 않는 법. 작업의 진검승부를 펼치는 마지막 승자는 누가 될 것인가? 그리고 수많은 작업에서 살아남은 자에게만 주어지는 로맨스의 달콤함을 그들도 누릴 수 있는 걸까?",https://images.justwatch.com/poster/10395053/s276/the-art-of-seduction.webp,"[('Naver Store', ['₩1,000', 'HD'])]"
화려한 휴가,,(2007),"[('Netflix', ['정액제', 'HD']), ('Watcha', ['정액제', 'HD'])]","[('wavve', ['₩1,540', 'HD']), ('Naver Store', ['₩1,540', 'HD'])]","['74%', '7.0 (1k)']","['액션 , 드라마 , 역사']",['1시간 58분'],['Kim Ji-hoon'],"['Kim Sang-kyung', 'Ahn Sung-ki', 'Lee Yo-won', 'Lee Joon-gi', 'Park Chul-min', 'Park Won-sang', 'Song Jae-ho', 'Na Moon-hee', 'Jung In-gi', 'Kwon Tae-won', 'Uhm Hyo-seop', 'Park Yong-soo', 'Lee Eol', 'Son Byung-ho']","광주에 사는 택시기사 민우(김상경 분). 어릴 적 부모님을 여의고 끔찍이 아끼는 동생 진우(이준기 분)와 단둘이 사는 그는 오직 진우 하나만을 바라보며 평범한 일상을 살고 있다. 진우와 같은 성당에 다니는 간호사 신애(이요원 분)를 맘에 두고 사춘기 소년 같은 구애를 펼치는 그는 작은 일상조차 소중하다. 이렇게 소소한 삶을 즐기는 이들에게 어느 날 갑자기, 생각지도 못한 무시무시한 일이 벌어진다. 무고한 시민들이 총,칼로 무장한 시위대 진압군에게 폭행을 당하고 심지어 죽임을 당하기까지 한다. 눈 앞에서 억울하게 친구, 애인, 가족을 잃은 그들은 퇴역 장교 출신 흥수(안성기 분)을 중심으로 시민군을 결성해 결말을 알 수 없는 열흘 간의 사투를 시작 하는데…",https://images.justwatch.com/poster/11481101/s276/may-18.webp,"[('wavve', ['₩6,050', 'HD']), ('Naver Store', ['₩6,050', 'HD'])]"
여고괴담 4: 목소리,,(2005),"[('Watcha', ['정액제', 'HD'])]","[('wavve', ['₩1,540', 'HD']), ('Naver Store', ['₩1,540', 'HD'])]","['71%', '6.3 (1k)']",['공포'],['1시간 44분'],['Choi Equan'],"['Kim Ok-vin', 'Seo Ji-hye', 'Cha Ye-ryun', 'Kim Seo-hyung', 'Lim Hyun-kyung', 'Eun-kyeong Na', 'Hwa-jung']","음산한 소리로 가득 찬 성원여고 지하 기계실. 영언과 선민은 이곳을 비밀 아지트로 삼은 둘도 없는 단짝 친구다. 교내 방송반 아나운서를 맡을 정도로 활기찬 선민과 달리 영언은 뛰어난 노래 실력 외에는 눈에 띄지 않는 조용한 아이. 늦은 밤, 텅 빈 음악실에 홀로 남아 노래 연습을 하는 영언의 노래 사이로 낯선 목소리가 끼어든다. 잿빛 교정을 감싸는 아름다운 화음의 노래 소리. 그 날 밤, 영언이 살해된다. 지루한 아침 조회시간, 선민은 영언의 빈자리가 계속 맘에 걸린다. 점심 방송을 진행하던 선민은 애타게 자신을 부르는 영언의 목소리를 듣는다. 하지만 비좁은 방송 부스 안에는 오직 선민 뿐! 선민은 실체 없는 영언의 목소리에 그만 그 자리에서 기절하고 만다. 선민은 영언의 목소리가 오직 자신에게만 들린다는 사실이 두렵지만, 목소리만 남은 친구를 외면 할 수 없다. 그러나 어젯밤 쓰러졌다던 엘리베이터 앞은 물론 학교 어느 곳에서도 영언의 흔적은 찾을 수 없고... 고심하던 선민은 평소 영언에게 각별한 관심을 보였던 음악 선생 희연을 의심한다. 그 날 밤, 영언과 함께 음악실을 찾은 선민. 깜깜한 음악실, 보면대 사이를 헤집던 선민은 첼로 줄에 목 맨 희연 선생의 시체와 마주하고 경악한다. 잇따른 의문의 사건들로 선민은 영언의 목소리를 들을 수 있다는 사실이 점점 더 두렵다. 혼란스러워하는 선민에게 같은 반 초아가 다가선다. 어릴 적부터 귀신의 소리를 들을 수 있었다고 고백하는 초아. 초아 역시 죽은 영언의 목소리를 듣고 있었던 것이다. 선민은 초아의 뜻밖의 행동에 적잖이 당황하면서도, 자신의 고민을 나눌 수 있는 상대가 생겼다는 사실에 위로 받는다. 그 무렵 학교 엘리베이터 통로에서는 목이 찢긴 영언의 시신이 발견되고, 선민에게 들리는 영언의 목소리가 기괴하게 변해 가는데...",https://images.justwatch.com/poster/29153436/s276/whispering-corridors-4-voice.webp,"[('wavve', ['₩6,050', 'HD']), ('Naver Store', ['₩6,050', 'HD'])]"
전학생,転校生 -さよなら あなた-,(2007),,"[('wavve', ['₩1,000', 'HD'])]","['73%', '6.7']","['판타지 , 코미디 , 드라마']",['2시간 0분'],['Park Ji-in'],"['Park Soo-yeon', 'Nam Ji-hye', 'Lee Joo-young', 'Kim Keum-soon']","중학교 3학년 가즈오의 반에 귀여운 소녀 카즈미가 전학을 온다. 첫눈에 가즈오를 알아 본 카즈미, 사실 둘은 어릴 적 소꿉친구였다. 흐릿한 기억을 되살려 어린 시절 추억의 장소를 가기로 한 둘은 숲 속 샘터에 물을 뜨러 간다. 그런데 실수로 둘은 물에 빠지게 되고 물에 흠뻑 젖은 가즈오와 카즈미는 각자 집으로 향한다. 집에 돌아온 둘은 자신들의 몸에 일어난 믿을 수 없는 변화를 알게 된다. 카즈오와 카즈미의 몸이 뒤바뀐 것이다. 어쩔 수 없이 서로의 인생을 살게 된 카즈오와 카즈미, 둘은 조금씩 서로를 이해하고 그들의 사이는 가까워진다. 그러던 어느 날 카즈오가 들어가 있는 카즈미 몸에 큰 병이 생기고 만다. 자신의 운명을 대신 짊어져야 하는 카즈오에게 미안한 마음뿐인 카즈미, 그런 카즈미를 위로하는 카즈오, 둘의 따뜻한 이야기가 펼쳐지는데...",https://images.justwatch.com/poster/138747633/s276/jeonhagsaeng.webp,"[('Naver Store', ['₩1,000', 'HD'])]"
연인들,,(2008),"[('wavve', ['정액제', 'HD'])]","[('wavve', ['₩2,200', 'HD'])]",['64%'],['드라마'],['1시간 21분'],['Kim Jong-kwan'],"['Jung Yu-mi', 'Kim Ga-eun']",독립영화계의 독보적인 감성지기 ‘김종관’ 감독의 단편영화 11편을 묶은 옴니버스 멜로.,https://images.justwatch.com/poster/197998760/s276/yeonindeul.webp,"[('Naver Store', ['₩2,000'])]"
공공의 적 2,,(2005),"[('Netflix', ['정액제', 'HD']), ('Watcha', ['정액제', 'HD'])]","[('wavve', ['₩1,540', 'HD'])]","['71%', '6.0']","['코미디 , 액션 , 드라마']",['2시간 28분'],['Kang Woo-suk'],"['Sol Kyung-gu', 'Jung Joon-ho', 'Kang Shin-il', 'Park Geun-hyung', 'Byun Hee-bong', 'Park Sang-wook', 'Uhm Tae-woong', 'Jeong Gyu-su', 'Choi Jung-woo', 'Park Woong']","검찰청 최고의 꼴통검사 강철중, 룸싸롱은 주로 쳐들어 가기 위해 자주 들르고 책상머리의 서류철 들여다보기 보다 컵라면 우물거리며 잠복근무가 체질인 그는 나쁜 짓 하는 놈 잡기 위해 부하와 동료의 피를 볼 순 없다는 일념으로 총기류 사용도 마다하지 않는 다혈질 검사다. 그렇지만 어제도 오늘도 그의 하루는 늘 나름대로 스마일~로 시작된다. 그런 그에게 명선 재단 이사장 한상우 사건이 접수되고 특유의 기질로 나쁜 냄새를 직감한 강검사, 자기 담당도 아닌 사건을 조사하기 시작한다. 명선고교는 다름아닌 강검사의 모교이며 학교 재단 이사장의 둘째 아들인 한상우 또한 자신과 3년 동안 같은 반에서 수학한 동기동창이었던 것. 재단을 물려받기로 되어 있던 명선 재단 큰 아들의 사고로 인해 재단 이사장으로 급부상한 한상우, 때마침 명선 재단 큰 아들이 숨을 거두고 그 죽음에 대한 의문이 제기되면서 강철중 검사의 수사는 큰 파문을 불러 일으킨다. 이에 철중은 조사인의 자격으로 상우를 검찰청에서 마주하게 되는데.",https://images.justwatch.com/poster/179511123/s276/another-public-enemy.webp,"[('wavve', ['₩6,050', 'HD'])]"
국경의 남쪽,,(2006),"[('Watcha', ['정액제', 'HD'])]","[('wavve', ['₩1,540', 'HD']), ('Naver Store', ['₩1,540', 'HD'])]","['67%', '6.7']",['드라마'],['1시간 49분'],['Ahn Pan-seok'],"['Cha Seung-won', 'Shim Hye-jin', 'Jo Yi-Jin', 'Song Jae-ho', '(uncredited)', 'Jang So-yeon', ""Sun-ho's mother""]",청년은 모두 잃고 말았다. 충성을 맹세했던 조국도.. 사랑을 약속했던 연인도.. 저는 1975년 조선로동당 창건일에 태어났습니다. 이름은 김선호. 만수예술단 호른 연주자이며 고향은 평양입니다. 저에게는 결혼을 약속한 연인 연화가 있었습니다. 성격도 얼굴도 동치미처럼 찡하구 시원한 연화가 난 정말로 좋았습니다.그러던 어느날 남조선에 계신 할아버지와의 비밀편지가 발각되어 전 국경을 넘을 수 밖에 없었습니다. 연화를 남겨두고 말입니다. 전 연화의 탈출 자금을 마련하기 위해 마음이 급했습니다. 그러나 시간이 흐르면 흐를수록 다신 못 만날 거란 생각에 막막해졌습니다. 그때 제 옆에 다가온 경주는 멍들었던 제 마음을 진심으로 어루만져 주었습니다. 그러던 어느날 연화가 국경을 넘어 내려왔습니다. 죽음을 각오하고 오직 한 사람 저를 찾아서 말입니다.,https://images.justwatch.com/poster/242004549/s276/over-the-border.webp,"[('wavve', ['₩6,050', 'HD']), ('Naver Store', ['₩6,050', 'HD'])]"
해부학 교실,,(2007),"[('Watcha', ['정액제', 'HD'])]","[('wavve', ['₩1,000', 'HD'])]","['64%', '5.6']",['공포'],['1시간 51분'],['Son Tae-woong'],"['Han Ji-min', 'On Ju-wan', 'Oh Tae-kyung', 'Jo Min-ki', 'Jin Yu-yeong', 'Park Chan-hwan', 'Detective', 'Eun-ju']","해부학 실습을 시작한 첫날, 최고의 의사를 꿈꾸는 여섯 명의 의대생에게 배정된 카데바는 가슴에 장미 문신이 남겨진 아름다운 카데바. 그 날 이후부터 알 수 없는 환영과 악몽에 시달리는 그들에게 피할 수 없는 죽음의 그림자가 드리워지는데...",https://images.justwatch.com/poster/241782122/s276/the-cut.webp,"[('Naver Store', ['₩1,000', 'HD'])]"
몽정기 2,,(2005),"[('wavve', ['정액제', 'HD'])]","[('wavve', ['₩1,000', 'HD'])]","['65%', '4.8']",['코미디'],['1시간 41분'],['Jeong Cho-sin'],"['Song Eun-Chae', 'Lee Ji-Hoon', 'Jeon Hye-bin', 'Shin Joo-ah', 'Kim Ji-young', 'Park Seul-gi', 'Jeon Jae-Hyeong', 'Park Ye-jin', 'Kim Hae-sook', 'AIDS/Chan Sung-Bok']","성(性)에 대해 생기초도 모르는 오성은, 그래도 셋 중에 가장 많이 아는 방수연, 아는 듯 모르는 듯 속을 알 수 없는 김미숙. 이들 3인방은 누구도 확실하게 이야기해 주지 않고, 어디서도 화끈하게 보여주지 않는 것들(?)에 대한 야릇한 호기심에 목말라 있다. 모락모락 피어오르는 이 성적 호기심이 여고 3인방의 머리 속에서 떠나지 않고 있을 때, 그녀들 눈앞에 최상의 작업모드와 왕뽀대를 자랑하는 교생 강봉구가 나타난다. 소녀들의 이 야릇한 호기심을 해결해 줄 ‘운명의 남자’로 점 찍힌 교생 봉구씨는 순식간에 그녀들의 직접 관찰(?), 실험(?) 대상이 된다. 봉구씨를 사로잡기 위해 호기심 3인방은 ‘뽕브라 하고 냅다 달려들기’, ‘귀에 신음소리 내기’, ‘교복 치마 7단 접기’, ‘봉구씨 거시기 훔쳐보기’ 등 나름 고난이도 섹시 테크닉을 총동원해 도발을 펼쳐보지만 어찌된 일인지 봉구씨는 꿈쩍도 안한다. 게다가 얼짱몸짱(=왕재수) 여고생 탤런트 백세미까지 봉구씨를 찜하면서 상황은 더 꼬여만 간다. 그녀들이 아무리 도발해도 먹히지 않았던 그이지만, 백세미의 ‘수업시간에 교복 단추 풀어헤치기’, ‘팔짱 끼는 척 가슴 문지르기’, ‘아이스크림 핥아먹기’ 등의 섹시 도발에는 꺼뻑 꺼뻑 넘아가다니!!. 더군다나 불여우 백세미는 대놓고 성은에게 아직 초경도 못한 어린애라고 놀리기까지. 질 수 없다! 마지막 수단, 이젠 봉구씨 덮치기다!",https://images.justwatch.com/poster/138659029/s276/wet-dreams-2.webp,"[('Naver Store', ['₩1,000'])]"
