제목,원제,개봉일,스트리밍,대여,평점,장르,재생 시간,감독,출연진,시놉시스,이미지,구매
오텁시,Autopsy,(2008),"[('wavve', ['정액제', 'HD'])]","[('wavve', ['₩1,200', 'HD'])]","['56%', '5.0 (6k)']","['스릴러 , 공포']",['1시간 24분'],['Adam Gierasch'],"['Robert Patrick', 'Jessica Lowndes', 'Jenette Goldstein', 'Michael Bowen', 'Robert LaSardo', 'Ross Kohn', 'Ashley Schneider', 'Ross McCall', 'Arcadiy Golubovich', 'Gregg Brazzel', 'Elijah Hardy', 'Tatyana Kanavka', 'Janine Venable']","바비, 에밀리, 클레어, 주드는 축제 때 만난 러시아 유학생 드미트리와 함께 흥겨운 밤을 즐긴다. 차를 몰고 같이 놀러가던 중 갑자기 교통 사고를 당한 일행은 난데 없이 피를 흘리며 등장한 병원 환자에 당황스러워한다. 그때 마침 응급차가 나타나 병원에서 탈출한 환자를 후송하고, 교통사고로 다친 에밀리 일행을 보면서 병원에 가서 검사를 맡으라고 제안하는데... 차가 엉망으로 고장나고, 크고 작은 부상을 입은 에밀리 일행은 병원에 따라간다. 하지만 어느 새 친구들은 수수께끼 같은 병원 속에서 하나 둘씩 사라진다.",https://images.justwatch.com/poster/234525552/s276/oteobsi.webp,
The Secret 시크릿,The Secret,(2006),"[('Netflix', ['정액제'])]",,['71%'],"['다큐멘터리 , Made in Europe']",['1시간 30분'],['Drew Heriot'],"['Bob Proctor', 'Joe Vitale', 'John Assaraf', 'Loral Langemeier', 'Marie Diamond', 'Michael Bernard Beckwith', 'Neale Donald Walsch', 'Jack Canfield']","론다 번이 2006년 제작한 영화이며, 책이다. 여기서 비밀이란 끌어당김의 법칙을 말한다. 즉, 비밀은 성공학에 관한 책이자 영화인 것이다. 비밀은 전 세계적으로 큰 인기를 얻고 있으며, 세계 최대 도서사이트들의 베스트셀러 기록을 깨기도 했다. 영화 비밀은 2006년 개봉되었고, 개봉되자 마자 큰 흥행을 불러 일으켰다. 영화 비밀에서는 제작자 론다 번이 직접 찾아낸 끌어당김의 법칙을 알고 있었던 사람들이 번갈아가며 나와서 끌어당김의 법칙에 대해 이야기하는 식으로 진행이 된다. 비밀에 출연한 사람들 중에는 밥 프록터,잭 캔필드,모리스 굿멘과 같은 유명인들이 많이 있다. 그들의 대화와, 사이사이 영상들을 첨가해서, 약 90분의 영화가 완성되었다. 영화 비밀은 DVD로 제작된 후로도 많은 소득을 올렸고, 지금까지도 큰 인기를 얻고 있다.",https://images.justwatch.com/poster/10140168/s276/the-secret.webp,
트리플 X 2: 넥스트 레벨,xXx: State of the Union,(2005),,"[('wavve', ['₩1,300', 'HD']), ('Naver Store', ['₩1,300', 'HD'])]","['55%', '4.5 (69k)']","['범죄 , 스릴러 , 액션 , SF']",['1시간 41분'],['Lee Tamahori'],"['Ice Cube', 'Samuel L. Jackson', 'Willem Dafoe', 'Scott Speedman', 'Peter Strauss', 'Xzibit', 'Michael Roof', 'Sunny Mabrey', 'Nona Gaye', 'John G. Connolly', 'Ramon De Ocampo', 'Barry Sigismondi', 'J. Anthony Brown', 'Bruce Bruce', 'David Rountree', 'Ned Schmidtke', 'Lisa Joyner', 'Gina St. John', 'Michael Don Evans', 'Brian Larsen', 'Jeanne Sakata', 'Jeffrey Moon', 'Todd Louiso', 'Matt Gerald', 'Eddy Shalita', 'J. J. Perry']","가장 강한 정보요원만을 관리하고 있는 버지니아주 NSA 지하본부가 정체불명의 테러집단에 의해 전멸당하는 상황이 발생한다. 일찍이 볼 수 없었던 대담한 공격에 커다란 위협을 직감한 기븐스(사뮤엘 잭슨)은 테러집단의 배후를 캐내기 위해서는 기존 요원보다 훨씬 강하고 독자적인 임무수행이 가능한 새로운 트리플X가 필요하다는 사실을 절감하고 누군가를 찾아나서는데... 새로운 트리플X 코드를 부여받은 후보자는 상관의 잔인한 명령에 불복종한 혐의로 정예 네이비씰에서 9년째 감금상태에 처해있는 다리우스 스톤(아이스 큐브). 일방적인 명령은 거부, 자신만의 방식으로 임무를 해치우던 다리우스는 테러공격은 미끼였을 뿐, 항공모함과 스텔스탱크 등 신무기를 총동원한 사상 최초의 국가전복 음모가 착착 진행되고 있다는 사실을 알게 되는데...",https://images.justwatch.com/poster/183789521/s276/teuripeul-egseu-2-negseuteu-rebel.webp,"[('Naver Store', ['₩5,000', 'HD']), ('wavve', ['₩5,500', 'HD'])]"
톰과 제리: 화성에 가다,Tom and Jerry Blast Off to Mars!,(2005),,,['73%'],['애니메이션'],['1시간 10분'],['Bill Kopp'],"['Jeff Bennett', 'Corey Burton', 'Kathryn Fiore', 'Brad Garrett', 'Jess Harnell', 'Tom Kenny', 'Bill Kopp', 'Rob Paulsen', 'Frank Welker', 'Billy West']","세기의 앙숙인 톰과 제리. 여느 날처럼 쫓고 쫓기는 사냥 놀이를 하던 톰과 제리는 우연히 화성 로켓 발사를 앞둔 국제 우주 센터에 들어가게 된다. 사냥 놀이에 몰두한 톰과 제리는 로켓이 발사되는 것도 모른 채 로켓에 탑승, 우주 비행사들과 함께 화성으로 향한다. 화성에 도착한 우주 비행사들은 제대로 둘러보지도 않은 채 화성에 생명체가 없다는 성급한 판단을 내린 후 지구로 귀환하고, 사냥 놀이에 빠져있던 톰과 제리는 지구로 귀환하는 로켓을 놓쳐 결국 화성에 남게 된다. 제리를 본 화성인들은 고서에 나와있는 위대한 예언자 글룹과 닮았다며 궁전으로 데려가 극빈 대접을 하고, 뒤이어 궁전에 도착한 톰은 몸집이 제리와 비슷한 화성인들에 의해 거인으로 오해를 받으며 뜻하지 않게 화성 도시를 파괴하게 된다. 결국 화성인들에게 사로잡힌 톰은 처형당할 위기에 처하는데 그 순간 한 화성인이 달려와 제리는 위대한 글룹이 아니며 톰과 제리 모두 지구에서 보낸 첩자라는 의견을 피력한다. 첩자로 몰린 톰과 제리는 화성인 핍의 도움으로 겨우 달아나지만, 화가 난 화성나라 국왕은 지구를 공격하기로 결정한다.",https://images.justwatch.com/poster/247643935/s276/tom-and-jerry-blast-off-to-mars.webp,"[('wavve', ['₩4,950', 'HD'])]"
캔디,Candy,(2006),,"[('wavve', ['₩1,200', 'HD'])]","['78%', '7.2 (44k)']","['로맨스 , 드라마']",['1시간 56분'],['Neil Armfield'],"['Abbie Cornish', 'Heath Ledger', 'Geoffrey Rush', 'Tom Budge', 'Roberto Meza-Mont', 'Tony Martin', 'Noni Hazlehurst', 'Tara Morice', 'Adrienne Pickering', 'Nathaniel Dean', 'Paul Blackwell', 'Damon Herriman', 'John McNeill', 'Jason Chan', 'Tim McKenzie']",우리는 완벽한 사랑에 빠졌다!,https://images.justwatch.com/poster/256164460/s276/kaendi.webp,
Keeping Up with the Steins,,(2006),,"[('Naver Store', ['₩1,600', 'HD'])]","['59%', '5.4 (3k)']",['코미디'],['1시간 30분'],['Scott Marshall'],"['Daryl Sabara', 'Jami Gertz', 'Jeremy Piven', 'Cheryl Hines', 'Carter Jenkins', 'Sandra Taylor', 'Larry Miller', 'Doris Roberts', 'Garry Marshall', 'Daryl Hannah', 'Britt Robertson', 'Miranda Cosgrove']","All hilarity breaks loose in this heartwarming coming-of-age comedy when three generations of Fiedlers collide in a crazy family reunion. As they prepare for the biggest Bar Mitzvah on the block, they begin to see that they're much more alike than they'd originally thought.",https://images.justwatch.com/poster/84121348/s276/keeping-up-with-the-steins.webp,"[('Naver Store', ['₩5,500', 'HD'])]"
벌들의 비밀 생활,The Secret Life of Bees,(2008),,,"['79%', '7.2 (25k)']",['드라마'],['1시간 54분'],['Gina Prince-Bythewood'],"['Dakota Fanning', 'Queen Latifah', 'Jennifer Hudson', 'Alicia Keys', 'Sophie Okonedo', 'Paul Bettany', 'Hilarie Burton', 'Tristan Mack Wilds', 'Nate Parker', 'Shondrella Avery', 'Renee Clark', 'Sharon Conley', 'Nicky Buggs', 'Jasmine Burke', 'Emma Sage Bowman', 'Addy Miller', 'Emily Alyn Lind', 'Taylor Kowalski', 'Bob Hungerford', 'Richard Todd Sullivan', 'Chris Moore', 'Bill Oberst Jr.', 'Cullen Moss', 'Walt Rider', 'Dan Beene', 'Joe Chrest', 'Robin Mullins', 'Tom Conder', 'Jay Pearson', 'Quentin Kerr']","인종 갈등과 폭력이 난무하던 1964년 미국 남부, 릴리 오웬스(다코타 패닝)는 거칠고 폭력적인 아버지 레이(폴 베타니) 밑에서 외롭게 살고 있는 열네 살 소녀. 엄마는 릴리가 네 살 때 죽었는데, 엄마의 죽음에 감춰진 진실로 인해 그녀는 끔찍한 죄책감에 사로잡혀 있다. 어느날, 릴리는 자신을 엄마처럼 돌봐주는 흑인 가정부 로잘린(제니퍼 허드슨)과 함께 시내에 나갔다가 극렬한 인종차별주의자들과 부딪힌다. 이 사건으로 로잘린이 위험해지자 릴리는 그녀와 함께 새로운 삶을 찾아 도망치기로 결심하고, 한때 엄마가 살았던 사우스캐롤라이나의 작은 마을로 향한다. 릴리는 그곳에서 양봉업을 하는 보트라이트 자매들의 집에 기거하게 되는데...",https://images.justwatch.com/poster/241068387/s276/the-secret-life-of-bees.webp,"[('Naver Store', ['₩5,500', 'HD'])]"
올 어바웃 스티브,All About Steve,(2009),"[('Disney Plus', ['정액제', 'HD'])]",,"['55%', '4.8 (41k)']","['코미디 , 로맨스']",['1시간 39분'],['Phil Traill'],"['Sandra Bullock', 'Thomas Haden Church', 'Bradley Cooper', 'Ken Jeong', 'DJ Qualls', 'Howard Hesseman', 'Keith David', 'Beth Grant', 'Katy Mixon', 'M.C. Gainey', 'Holmes Osborne', 'Delaney Hamilton', 'Jason Jones', 'Carlos Gómez', 'George Sharperson', 'Luenell', 'Kerri Kenney-Silver', 'Jackie Johnson', 'Lucy Davis', 'Hari Kondabolu', 'Sara Sanderson', 'Himself', 'Receptionist']","신문사의 낱말 맞추기 출제를 담당하는 메리 호르위츠(샌드라 블럭)는 낙천적인 성격의 노처녀. 소개팅에서 만난 케이블 TV의 미남 촬영 기자 스티브(브래들리 쿠퍼)가 진정한 사랑이자 소울메이트라고 확신한 메리는 그에 대한 내용으로만 낱말 맞추기를 출제했다가 해고 통지를 받는다. 일자리를 잃은 그녀는 스티브가 사건을 찾아서 출동하는 곳은 전국 어디든 따라가기로 결심하고 행동에 옮긴다. 그녀의 스토킹은 스티브의 동료인 하트맨(토마스 헤이든 처치)의 도움으로 탄력을 받고, 이에 따라 스티브는 점점 혼란스러워진다. 그러던 어느 날, 메리 일행은 청각장애 어린이들이 폐광에 갇혔다는 속보를 듣고 현장으로 향한다. 모든 아이들이 무사히 구출된 직후, 땅이 꺼지면서 메리가 폐광에 갇히는데…",https://images.justwatch.com/poster/176266373/s276/all-about-steve.webp,"[('Naver Store', ['₩5,500', 'HD'])]"
썸머 솔스티스,Solstice,(2008),"[('wavve', ['정액제', 'HD']), ('Watcha', ['정액제', 'HD'])]","[('wavve', ['₩1,200', 'HD'])]","['60%', '5.3 (6k)']","['공포 , 코미디 , 판타지 , 로맨스']",['1시간 31분'],['Daniel Myrick'],"['Elisabeth Harnois', 'Shawn Ashmore', 'Amanda Seyfried', 'Hilarie Burton', 'Tyler Hoechlin', ""Matt O'Leary"", 'Lisa Arnold', 'R. Lee Ermey', 'Lyle Brocato', 'David Dahlgren']","쌍둥이 동생 소피의 갑작스런 자살에 혼란스런 매건. 매건은 동생을 잃은 슬픔을 달래기 위해 친구들과 함께 매년 하지(夏至)때마다 묵었던 호수 별장으로 여행을 떠난다. 하지(夏至) 때 동생 소피와 함께 보낸 시간들이 계속 떠오르는 매건은 소피의 물건들을 하나하나씩 정리하고, 소피의 연인이자 매건의 친구인 크리스찬은 슬픔에 잠긴 매건을 사랑으로 감싸 안는다. 죽은자와 산자의 경계가 무너지는 하지(夏至)가 다가오면서 알 수 없는 기이한 일들이 일어나고, 매건은 동생 소피의 영혼이 자신의 곁에 맴돌고 있음을 느낀다. 자신에게 무언가를 말하려 한다는 것을 직감한 매건은 동생의 영혼을 깨우기 위해 죽은자의 영혼을 부르는 하지의식을 치르는데… 하지만, 하지의식 후… 매건은 정체를 알 수 없는 저주의 기운이 더욱 강해짐을 느끼게 되고, 소피가 아닌 또 다른 영혼의 저주에 휩싸이게 되는데…",https://images.justwatch.com/poster/57389168/s276/solstice.webp,"[('Naver Store', ['₩1,200', 'HD'])]"
워터 릴리스,Naissance des pieuvres,(2007),"[('wavve', ['정액제', 'HD']), ('Watcha', ['정액제', 'HD'])]","[('wavve', ['₩1,200', 'HD'])]","['72%', '6.7 (11k)']","['드라마 , Made in Europe , 로맨스']",['1시간 25분'],['Céline Sciamma'],"['Pauline Acquart', 'Adèle Haenel', 'Louise Blachère', 'Warren Jacquin', 'Christel Baras', 'Marie Gili-Pierre', 'Alice de Lencquesaing', 'Claire Pierrat', 'Barbara Renard', 'Esther Sironneau', 'Jérémie Steib', 'Yvonne Villemaire', 'Christophe Vandevelde', 'Céline Sciamma']","싱크로나이즈드 선수 ‘플로리안’을 본 순간 ‘마리’는 덜컥 사랑에 빠져버린다. 하지만 ‘플로리안’은 모든 남성들의 선망을 받고, 남자들과 자유로운 관계를 맺는 것 처럼 보인다. ‘플로리안’의 모든 것이 알고 싶고, 갖고 싶은 ‘마리’. 한편, ‘마리’의 절친 ‘안나’는 수영부 남학생 ‘프랑수아’와 첫키스를 하기 위해 노력한다. 처음 느끼는 사랑의 감정! 사랑에 빠지고, 사랑에 눈뜬 소녀들의 올 여름, 가장 거침없고 감각적인 드라마가 찾아온다.",https://images.justwatch.com/poster/195438295/s276/weoteo-rilriseu.webp,"[('Naver Store', ['₩2,500', 'HD'])]"
캐딜락 레코드,Cadillac Records,(2008),"[('Watcha', ['정액제', 'HD'])]",,"['77%', '7.0 (20k)']","['드라마 , 음악']",['1시간 49분'],['Darnell Martin'],"['Adrien Brody', 'Jeffrey Wright', 'Beyoncé', 'Gabrielle Union', 'Columbus Short', 'Cedric the Entertainer', 'Emmanuelle Chriqui', 'Eamonn Walker', 'Yasiin Bey', 'Valence Thomas', 'Jay O. Sanders', 'Norman Reedus', 'Aaron Munoz', 'Kevin Mambo', 'Chyna Layne', 'Albert Jones', 'Osas Ighodaro', 'Jordan Haynes', 'Suzette Gunn', 'Jill Flint', 'Shiloh Fernandez', 'Eshaya Draper', 'Eric Bogosian', 'Tammy Blanchard', 'Tony Bentley', 'Veronika Dash', 'Dexter Darden', 'Wade Mylius', 'Rayan Lawrence']","1950년대는 시카고 블루스의 전성기였다. 블루스 명가로 이름을 떨쳤던 체스 레코드와 소속 가수들의 번성과 몰락을 그린 영화. 음악산업을 둘러싼 섹스, 폭력, 배신과 음모가 시카고를 배경으로 펼쳐진다.",https://images.justwatch.com/poster/179620513/s276/kaedilrag-rekodeu.webp,
회오리 바람,,(2009),"[('Watcha', ['정액제', 'HD'])]","[('wavve', ['₩1,500', 'HD'])]","['67%', '6.4']",['드라마'],['1시간 36분'],['Jang Kun-jae'],"['Seo Jun-yeong', 'Lee Min-ji', 'Kwon Hyeok-Pung', 'Han Na', 'Choe Hyo-sang', 'Choe Hyeon-suk', 'Pak Mun-a', 'Baek seong-soo']","18살 태훈은 미정과 함께 연애 100일을 기념하기 위해 동해 바다로 여행을 떠난다. 행복한시간도 잠시, 집으로 돌아온 둘은 부모님에게 이 사실을 들키게 되고, 미정의 부모는 급기야 태훈과 태훈의 부모를 집으로 불러 '대학 입학 전까지는 절대로 만나지 않겠다'는 각서까지 받아낸다. 그 날 이후, 미정은 태훈을 피하기 시작하고, 태훈은 미정을 만날 수 없다는 사실에 애가 탄다. 겨울이 지나고, 태훈과 미정은 19살의 봄을 맞이한다. 이야기는 이제 막 사랑을 알기 시작한 청춘들의 조심스럽고 조금은 씁쓸한 러브 스토리이다. 강렬한 사랑의 불꽃은 풋풋하고 순수한 젊음에 지울 수 없는 흔적을, 상처를 남긴다.",https://images.justwatch.com/poster/171128156/s276/eighteen.webp,"[('Naver Store', ['₩1,500', 'HD'])]"
치킨 리틀,Chicken Little,(2005),"[('Disney Plus', ['정액제', 'HD'])]",,"['65%', '5.7 (89k)']","['코미디 , 판타지 , SF , 애니메이션 , 가족']",['1시간 21분'],['Mark Dindal'],"['Zach Braff', 'Amy Sedaris', 'Steve Zahn', 'Joan Cusack', 'Garry Marshall', 'Don Knotts', 'Fred Willard', ""Catherine O'Hara"", 'Mark Walton', 'Sean Elmore', 'Matthew Josten', 'Evan Dunn', 'Mark Dindal', 'Dan Molina', 'Patrick Stewart', 'Wallace Shawn', 'Patrick Warburton', 'Adam West', 'Harry Shearer', 'Joe Whyte', 'Kelly Hoover', 'Will Finn', 'Dara McGarry', 'Mark Kennedy', 'Terri Douglas', 'Pat Fraley', 'Scott Menville', 'Aaron Spann']","갑자기 하늘에서 떨어진 무언가에 의해 머리를 강타당한 치킨 리틀은 하늘이 무너지고 있다고 확신하고, 고향 마을인 오우키 오크를 대혼란으로 몰고간다. 허나 그의 머리 위로 떨어진 것은 다름 아닌 도토리... 이로 인해 1년간 모든 이들의 놀림감이 된 치킨 리틀은 자신의 명예를 회복하기 위해 결심을 하지만, 마음먹기가 무섭게 또다시 치킨 리틀의 머리 위로 무언가가 떨어지는데... 이번에는 진짜 하늘이 무너져 내리고 있는 것일까?! 마른 하늘에 구멍이 뚫린 절대절명의 위기 속에서 세상을 구하기 위해 모험을 떠나는 치킨 리틀과 그의 절친한 친구인 런트, 애비 말라드, 피쉬의 깜짝 놀랄 이야기...",https://images.justwatch.com/poster/182365692/s276/chicken-little.webp,"[('wavve', ['₩5,500', 'HD']), ('Naver Store', ['₩5,500', 'HD'])]"
척 앤 래리,I Now Pronounce You Chuck & Larry,(2007),"[('Netflix', ['정액제', 'HD'])]","[('wavve', ['₩1,200', 'HD']), ('Naver Store', ['₩1,200', 'HD'])]","['66%', '5.9 (144k)']","['코미디 , 로맨스']",['1시간 55분'],['Dennis Dugan'],"['Adam Sandler', 'Kevin James', 'Jessica Biel', 'Dan Aykroyd', 'Ving Rhames', 'Steve Buscemi', 'Nicholas Turturro', 'Allen Covert', 'Rachel Dratch', 'Nick Swardson', 'Richard Chamberlain', 'Jamie Chung', ""Becky O'Donohue"", 'Shelby Adamowsky', ""Jessie O'Donohue"", 'Chandra West', 'Jackie Sandler', 'Kathleen Doyle', 'Tila Tequila', 'Jina Song', 'Candace Kita', 'Lena Yada', 'Richard Kline', 'Blake Clark', 'Mary Pat Gleason', 'Matt Winston', 'Lance Bass', 'Dave Matthews', 'Dan Patrick', 'Rob Corddry', 'Robert Smigel', 'Gary Valentine', 'Jonathan Loughran', 'Peter Dante', 'Michael Buscemi', 'J.D. Donaruma', 'Cole Morgen', 'Brad Grunberg', 'Marc Vann', 'Rob Schneider', 'David Spade']","뉴욕 브루클린 소방서의 자랑거리인 소방관 척(아담 샌들러)과 래리(케빈 제임스)는 둘도 없는 죽마고우. 바른생활 맨인 싱글 대디 래리와는 달리, 척(아담 샌들러)은 여자들과의 데이트만이 유일한 관심사인 초절정 작업맨이다. 불의의 사고에 대비해 두 아이를 위한 생명보험 가입 조건으로 결혼이 필요해진 래리는 어느 날, 화재 현장에서 척의 생명을 구해주게 되고, 이를 대가로 척은 래리와 ‘男男 커플’ 부부로 위장하게 된다. 하지만 시 공무원이 둘 사이를 의심하면서, 이들은 자신들이 부부임을 변론하기 위해 인권 변호사 알렉스(제시카 비엘)를 찾아가게 된다. 섹시할 뿐 아니라 성격까지 좋은 완벽한 여자 알렉스에게 한눈에 반하게 된 척. 이 때부터 척과 래리의 강철같던 30년 우정은 흔들리고, 이들의 ‘위장 부부 생활’은 최대의 위기를 맞게 되는데...",https://images.justwatch.com/poster/10990251/s276/i-now-pronounce-you-chuck-and-larry.webp,"[('wavve', ['₩4,000', 'HD']), ('Naver Store', ['₩5,000', 'HD'])]"
Santa Buddies,,(2009),"[('Disney Plus', ['정액제', 'HD'])]",,['66%'],"['가족 , 액션']",['1시간 28분'],['Robert Vince'],"['George Wendt', 'Ellie Harvie', 'Charisse Baker', 'Zachary Gordon', 'Richard Kind', 'Danny Woodburn', 'Tom Bosley', 'Tim Conway', 'Craig Anton', 'Andrew Astor', 'Field Cate', 'Chris Coppola', 'Josh Flitter', 'Ben Giroux', 'Skyler Gisondo', 'Ryan Grantham', 'Christopher Lloyd', 'Quinn Lord', 'Kaitlyn Maher', 'Gig Morton', 'Liliana Mumy', 'Nic Novicki', 'Ty Panitz', 'Mikey Post', 'Paul Rae', 'Aramis Knight', 'Nico Ghisi', 'Sophia Ludwig', 'Isabella Montes', 'William Samples', 'Michael Teigen', 'Patricia Cullen', 'Michelle Andrew', 'Brandon Nomura', 'Jonathan Morgan Heit']","When Puppy Paws, the fun-loving son of Santa Paws, gets bored, he finds Budderball on Santa's naughty list and figures he's just the dog to show him how to be an ordinary pup. When the magical Christmas Icicle starts to melt however, and the world begins to forget the true meaning of the season, it's up to Puppy Paws and his newfound Buddies to journey back to the North Pole and save Christmas.",https://images.justwatch.com/poster/179203481/s276/santa-buddies.webp,"[('Naver Store', ['₩5,500', 'HD'])]"
룩아웃,The Lookout,(2007),,"[('Naver Store', ['₩1,600', 'HD'])]","['74%', '7.0 (58k)']","['드라마 , 스릴러 , 범죄 , Made in Europe']",['1시간 39분'],['Scott Frank'],"['Joseph Gordon-Levitt', 'Jeff Daniels', 'Matthew Goode', 'Isla Fisher', 'Carla Gugino', 'Bruce McGill', 'Alberta Watson', 'Alex Borstein', 'Sergio Di Zio', 'David Huband', 'Greg Dunham', 'Morgan Kelly', 'Aaron Berg', 'Tinsel Korey', 'Suzanne Kelly', 'Brian Edward Roach', 'Martin Roach', 'Ofield Williams', 'Julie Pederson', 'Stephen Eric McIntyre', 'Janaya Stephens', 'Marc Devigne', 'Courtney-Jane White', 'Thanya Romero', 'Paul Christie', 'Tracy McMahon', 'Gordie Farrell', 'Toni Reimer', 'Ted Felbel', 'Charles Crossin', 'Chuck Robinson', 'Kalyn Bomback', 'John Bluethner', 'Leslie Bais', 'Harry Nelken', 'Laura Vandervoort']",좋은 집안에 고등학교 시절 아이스하키선수로 유망주를 꿈꿨지만 한 순간의 실수로 꿈도 잃고 기억력까지 잃어버린 크리스는 은행의 야간청소부로 전락하고 만다. 마치 영화 ‘메멘토’의 주인공처럼 무슨 일을 하려면 노트에 일일이 적어야 하는 크리스. 맹인인 루이스와 스트리퍼인 러블리만이 크리스의 유일한 친구이다. 그런 그에게 고등학교 시절 친구였던 게리가 나타난다. 불량스러운 게리가 크리스에게 나타난 이유는 은행을 털자는 것. 바로 크리스가 일하는 은행을 목표로 하고 있었던 것이다. 갈수록 기억력이 떨어져가는 크리스는 절망 끝에 범죄와 손을 잡게 된다. 하지만 그들에게 이용만 당한 크리스는 은행을 턴 돈을 가로채고 게리 일당과 접전을 벌이게 되고...,https://images.justwatch.com/poster/181463617/s276/the-lookout.webp,"[('Naver Store', ['₩5,500', 'HD'])]"
낯선 사람에게서 전화가 올 때,When a Stranger Calls,(2006),,"[('wavve', ['₩1,300', 'HD']), ('Naver Store', ['₩1,300', 'HD'])]","['61%', '5.1 (45k)']","['공포 , 스릴러']",['1시간 27분'],['Simon West'],"['Camilla Belle', 'Katie Cassidy', 'Tommy Flanagan', 'Brian Geraghty', 'Clark Gregg', 'Derek de Lint', 'Kate Jennings Grant', 'Steve Eastin', 'Tessa Thompson', 'David Denman', 'Arthur Young', 'Madeline Carroll', 'Escher Holloway', ""Rosine 'Ace' Hatem"", 'Molly Bryant', 'John Bobek', 'Brad Surosky', 'Karina Logue', 'Owen Smith', 'John Waugh', 'Dianna Agron', 'Lance Henriksen']","여고생 ‘질’은 아이들을 돌봐주는 베이비씨터 아르바이트를 위해 외딴 언덕 위 호화로운 저택에서 하루를 보내게 된다. 감기로 아이들이 잠들어 있음을 집주인에게 미리 전해들은 ‘질’은 모든 것이 최첨단으로 통제되어 있는 폐쇄적인 대저택에서 무료함을 달래며 혼자만의 시간을 가지게 된다. 그러던 중 갑자기 걸려오는 한 통의 전화. “아무일 없나?” 라며 신분을 밝히지 않는 자의 목소리. ‘질’은 처음엔 그냥 장난전화로 받아 넘긴다. 하지만 다시 걸려온 낯선 사람의 전화. “아이들이 잘 있는지 확인해 봤나?” 그는 분명 그녀를 지켜보고 있다! 낯선 사람으로부터의 전화.. 그리고, 서서히 다가오는 공포! 신분을 숨긴 채 계속 걸려오는 이상한 전화에 ‘질’은 점점 불안에 휩싸이고, 그러던 차에 잠시 놀러 왔던 친구 ‘티파니’가 시체로 발견하게 되면서 ‘질’은 걷잡을 수 없는 공포에 휩싸이게 된다. 점점 두려움으로 다가오는 전화 벨 소리 속에 ‘질’은 폐쇄된 저택 안에서 누군가의 그림자를 발견하는데…",https://images.justwatch.com/poster/249392311/s276/when-a-stranger-calls.webp,"[('Naver Store', ['₩5,000', 'HD']), ('wavve', ['₩5,500', 'HD'])]"
리포! 더 제네틱 오페라,Repo! The Genetic Opera,(2008),,"[('wavve', ['₩1,000', 'HD'])]","['71%', '6.6 (24k)']","['공포 , SF']",['1시간 38분'],['Darren Lynn Bousman'],"['Alexa PenaVega', 'Paul Sorvino', 'Anthony Stewart Head', 'Sarah Brightman', 'Paris Hilton', 'Bill Moseley', 'Nivek Ogre', 'Terrance Zdunich', 'Sarah Power', 'Jessica Horn', 'Branko Lebar', 'Briana Buckmaster', 'Joan Jett', 'Brad Austin']","멀지 않은 미래, 2056년. 인류는유행성 장기 기능 장애로 멸종의 위기에 처한다. 비극 속에 나타난 구세주는 인공 장기를 판매하는 생명공학 회사 ‘GeneCo’다. 그러나 그들은 인공 장기의 생산뿐만 아니라 다른 일도 담당하게 되는데... 그것은 장기를 가져간 뒤 지불이 연체된 사람들의 장기를 다시 빼앗는 일! 이 일을 담당하는전문 살인청부업자를 바로 ‘리포맨’이라 부른다.",https://images.justwatch.com/poster/98805490/s276/ripo-deo-jenetig-opera.webp,
